"returning west virginia teachers unceremoniously toss hundreds of dead class pets into trash",2
"after one too many fouls, the world cup deserves a red card",0
"when my office is a target -- reflections from a veteran white house reporter",0
"al gore gets to third",2
"panic floods mike pence's system before realizing hand on knee his own",2
"the groundbreaking queer comedy series 'take my wife' is back",0
"sleeping middle-aged businessman in airport suddenly so childlike, so vulnerable",2
"sears extremists fly plane into willis tower",2
"paul krugman's facebook friends excitedly posting about new article he got published in 'the new york times'",2
"'secretary clinton is a different person than donald trump,' says bernie sanders in ringing endorsement",2
"how our allies in asia see the presumptive republican nominee",0
"julie andrews: i've 'just always' been an lgbtq ally",0
"sen. dick lugar placed on congressional disabled list with strained hamstring",2
"here comes another massive media deal",0
"report: shame of walking out without buying anything drives 90% of purchases at small businesses",2
"life-raft companion looks just like juicy steak",2
"afghanistan: a morally corrupting war",0
"'i am under 18' button clicked for first time in history of internet",2
"single mother working 3 minimum-wage jobs just trying not to live in the moment",2
"god completely fucked up after huffing gaseous planet",2
"cop crashed cruiser into ditch after this owl attacked his head",0
"dog waited in this spot for a month for her family to return",0
"use of organic peanut butter adds two minutes to local man's life",2
"liquor's neon coloring likely good measure of its excellence",2
"russia's economy headed for even more trouble",0
"remainder of ross ice shelf now in smithsonian freezer",2
"66-year-old 'washington post' reporter hopes he liveblogged state of the union right",2
"stephen colbert to face fcc investigation over 'homophobic' donald trump joke",0
"princess charlotte has maybe the most fashionable christening ever",0
"carol chapman's gps guide for better sleep",0
"how i learned to love my body",0
"person of interest detained after california mosque 'firebombed'",0
"man unsure how to expose self to woman he likes without coming off as a creep",2
"ex-boyfriend just thought he'd check in and throw entire day off",2
"man taking photo with ipad oblivious to how badass he looks",2
"why starting a company is a crazy thing",0
"this desperate dad is trying to ward off the terrible twos",0
"'family' groups blast boy scouts' decision to allow trans kids",0
"holy mother of all that is good, 'curb your enthusiasm' is officially back",0
"single-engine cessna crashes into bush",2
"juan gabriel wins first ever latin grammys three months after death",0
"el salvador is on track to become world homicide leader",0
"james corden makes emotional plea for gun control after vegas tragedy",0
"sh*t talk: everything you need to know about pooping at the office",0
"dental hygienist sick of being lied to",2
"former pennsylvania congressman sentenced to 10 years in prison",0
"report: iran less than 10 years away from 2016",2
"turkey says it will suspend high-level diplomatic ties with netherlands",0
"nation's voyeurs watch women's march on washington from bushes",2
"neither person in conversation knows what hedge fund is",2
"what it's like to get nexplanon, the birth control implant in your arm",0
"climate change could lead to an uptick in type-2 diabetes",0
"tolerance for women and girls in afghanistan, not silence",0
"the truth about generic vs. brand-name medications",0
"either someone 14th caller or everything on fire at spanish radio station",2
"money spent for old time's sake",2
"thirtysomething scientists unveil doomsday clock of hair loss",2
"the 5 things your kids will remember about you",0
"trump administration decides to add a question about citizenship to 2020 census",0
"cash-strapped oscars to give out emmys",2
"all y'all urged to go fuck yo' selves",2
"best off-the-radar foreign retirement spots",0
"pfizer researchers discover new stimulating, medicating, captivating cure for what ails you",2
"bill cosby feeling better about retrial now that climate around sexual assault has cooled down",2
"report: shopoholism may have killed the shoposauruses",2
"whatsapp finally adds fully-encrypted video calling service",0
"the power of keeping it personal",0
"#dirtydenier$ day 9: congressman john kline",0
"why trump's lies and transgressions appeal to his followers",0
"white house designer michael smith talks obamas and industry secrets",0
"heart-shaped jacuzzi  clogged again",2
"mike pompeo's anti-gay views should disqualify him",0
"12 illustrations that pay tribute to the late, great carrie fisher",0
"mobile app to revolutionize way users waste time, money",2
"area mother doesn't see why thai people need to make food so spicy",2
"changing how we study political divisions just might help us heal them",0
"rich white people get latino guy to do some work for them",2
"the impossible conversation: talking to children about islamophobia",0
"joel siegel 'absolutely loved' dream he had last night",2
"man attends 25-year nursery school reunion",2
"amber rose fearful over breast reduction surgery on wednesday",0
"lifeguard hoping to make up for last summer",2
"the sound of president trump's silence",0
"demoralized jeb bush succumbs to new hampshire heroin epidemic",2
"women in hollywood perfectly okay they not represented behind the scenes of 'the blacklist'",2
"mom of transgender teen describes her experience as a gift",0
"norman reedus teases a big 'walking dead' easter egg in season 6",0
"rick perry on donald trump's proposed border wall: 'you can't do that'",0
"justin trudeau is king of the political sock game no more",0
"angelina jolie refutes vanity fair's portrayal of controversial auditions",0
"gulf of mexico inducted into opec",2
"scientists claim solar energy will be capable of powering 95% of scorchlands outposts by 2085",2
"woman wonders whatever happened to those rainforests she gave $5 to save that one time",2
"girl slept with for her sake",2
"literary study finds all modern narratives derived from classic 'alien vs. predator' conflict",2
"discouraged bush begins seeking approval of other nations",2
"controversial puppy bowl star shits during national anthem",2
"locks of love completes construction of massive hair silo capable of holding 150,000 pounds of hair",2
"huffpost hill - trump heads to louisiana, will distribute the classiest, absolute best mres",0
"furloughed bison pour back into national parks after government reopens",2
"antonin scalia's death just cost this company $835 million",0
"stephen colbert thinks he's found proof: 'there is definitely a pee pee tape'",0
"area father beginning to suspect 3-year-old a real ding-dong",2
"employee keeps up the good work",2
"'crisis actor' alex jones gets a taste of his own medicine in brilliant troll",0
"trump administration finds a new way to fight with the uk",0
"why erlich on 'silicon valley' is the best and the worst",0
"movie theater employee hurt by customer's comments about high price of popcorn",2
"new forced-retirement community opens for local 60-year-olds",2
"single woman has facebook profile picture with sister",2
"report: shit, last night was trash night",2
"unstoppable killing machine out of toner",2
"a sadder pride because of washington inaction",0
"warpaint's theresa wayman on the band's 'vivid' new album and inevitably questioning her career",0
"inspirational poster kitten falls to death after 17 years",2
"out-of-control conversation safely turned back onto self",2
"new program provides depressed americans with suicide assistance dogs",2
"hamburglar urges senate subcommittee to 'robble robble robble'",2
"man completes life $130,000 over budget",2
"report: many americans not watching enough television to make worthwhile contribution to small talk",2
"what it means to survive a hurricane",0
"officemates unwittingly spend entire workday talking to each other on grindr",2
"buzzfeed's 'try guys' tackle immigration and the results are emotional",0
"monopoly player insists on being wheelbarrow",2
"olympic figure skater cosplays jaime lannister for 'game of thrones' routine",0
"silicon breast implants perform millions of calculations per second",2
"mandy moore shows off shiny new engagement ring at 2017 emmy awards",0
"party host horrified to discover guests have been drying hands on bath towel this whole time",2
"video appears to show 76er jahlil okafor in street fight",0
"mysteryland 2014 set times announced",0
"passengers praying uber just a hobby for elderly driver",2
"black twitter is freaking out over harriet tubman on the $20 bill",0
"michigan's congressional hopefuls worry about the next flint",0
"president trump's iran deal message to north korea: do not trust washington",0
"no, the queen isn't being shady about meghan markle and prince harry's wedding",0
"area man's recommended daily caloric intake exceeded by 9 a.m.",2
"hannity rips jimmy kimmel in off-the-rails feud as 'twisted, creepy weirdo'",0
"attending 'price is right' taping apparently sailors' best idea for shore leave",2
"early humans finally drunk enough to invent dancing",2
"wither the democrats?",0
"the ukraine: what would churchill do?",0
"'an invitation to kill': proxies, foreign powers in syria endanger civilians",0
"colorful multicultural mural celebrates diverse lack of talent",2
"coloradans who deregistered after trump request for voter data aren't signing up again",0
"trans women and trans men offer intimate answers to personal questions",0
"islamic awakening inspires man to defect from isis",2
"george zimmerman not going to let one bad experience deter him from neighborhood watch responsibilities",2
"former playboy model accuses oliver stone of groping her breast",0
"four black trailblazers on how they are empowering communities of color",0
"the best far-flung hotels worth the trip",0
"critics accuse new movie of glorifying sex",2
"cute new dog helping single man pick up tons of hot shit",2
"1998 powerball winner returns to food-service job",2
"report: it okay to spend rest of day curled in fetal position under desk",2
"pretty little liars 501: 'escape from new york'",0
"christmas eve shooting kills 1 at louisiana mall",0
"did trump revive failed cold war cuba policy to buy rubio's loyalty?",0
"here's every easter egg you missed in 'guardians of the galaxy'",0
"the challenge of exclusivity",0
"reflections from ivy day",0
"deep orange sun slowly, beautifully setting on topher grace's career",2
"horatio sanz sweeps latin emmys",2
"world could face months of chinese market aftershocks",0
"new study finds most of earth's landmass will be phoenix suburb by 2050",2
"louis c.k. just dropped a new show",0
"god reveals jerusalem actually only 87th holiest site on earth",2
"pokemon go leads players into intimacy boutique",0
"madonna gives birth to million-dollar marketing scheme",2
"what's really going on with twitter?",0
"artist's stunning image honors the moment one woman defied a neo-nazi march",0
"gothamist sites and dnainfo shut down after staffers unionize",0
"nancy pelosi rushes into living room to hear grandson's first talking point",2
"the important reason why we need to embrace creativity",0
"here's what reagan and bush had to say about immigration",0
"bank robbers fail to consider o'reilly factor",2
"man just using virgin mary to get to jesus",2
"angela merkel opens up to the only newspaper she trusts",2
"obesity: an individualized approach doubles the success rate of weight loss therapy",0
"the mouse that roared",0
"tom hanks in carly rae jepsen's 'i really like you' video is oddly entertaining without music",0
"catholic teens still coming down after excitement of world youth day",2
"new, lighter iphone hailed by exhausted, humpbacked iphone 4 users",2
"gun used to kill man in city",2
"filming police in public places: a risky first amendment activity for citizen journalists",0
"rural south dakotan walks away from first encounter with jewish man, shaken but unharmed",2
"new historical evidence suggests most pilgrims sailed back home to celebrate first thanksgiving",2
"john orozco breaks down after qualifying for usa gymnastics team",0
"iran ready to talk about how awesome nuclear program is",2
"the best men's sunglasses looks for summer",0
"pastor talking to non-christian who just lost wife can smell blood",2
"donald trump, we need to talk about what a poll is",0
"proud to be a total b*tch",0
"pope francis prays at jerusalem's western wall",0
"colorado's new revenge porn statute is good law and sound policy",0
"elmore leonard, modern prose master, noted for his terse prose style and for writing about things perfectly and succinctly with a remarkable economy of words, unfortunately and sadly expired this gloomy tuesday at the age of 87 years old",2
"t.i. calls for boycott of restaurant after off-duty cop allegedly assaults 3 black women",0
"pope francis trains for easter mass by dragging pew loaded with rocks across snow",2
"darrelle revis to be charged in fight that leaves two men unconscious",0
"charles durning hocks up four-pound chunk of phlegm",2
"lindsey graham asks nearby family to take his picture for photo op",2
"video shows london marathoner helping fellow runner over finish line",0
"david axelrod's view inside the economic storm obama inherited in 2009",0
"#mewesyria: resistance and hope",0
"hillary's email, hillary's truth",0
"julianne hough lived in pain for years because of endometriosis",0
"to read or not to read, part 2",0
"confederate flag doesn't fly with california lawmakers",0
"leader of sea-doo riders holds court in middle of lake",2
"in defense of the promposal",0
"terrified laptop wakes up inside case",2
"jimmy fallon could barely keep it together during this cardi b interview",0
"behold, chris christie's fawning 'interview' with donald trump",0
"the conundrum of the midterms",0
"violinist sick of doing mozart covers",2
"dozens of leads, no arrests in ferguson police shooting",0
"firefighters turned away from exclusive nightclub blaze",2
"russia's power shut off",2
"guy just totally smoking weed on street",2
"report: texting while driving okay if you look up every couple seconds",2
"a tribute to david goldberg: entrepreneur, connector, mensch",0
"local senior brutally folded in craftmatic adjustable bed accident",2
"10 days that shook the regressive world",0
"what will the disruption of politics look like?",0
"isis vs isil -- what's in a name?",0
"screaming japanese schoolgirls overturn greenspan's bus",2
"study finds eating doctor after birth can provide essential nutrients to new mothers",2
"chrissy teigen would like everyone to stop worrying about her baby, thanks",0
"dog, cat and squirrel drama escalates in a hurry",0
"it's mildly infectious and treatable─yet patients still face discrimination",0
"woman only willing to learn new things in settings called boot camp",2
"these vertigo-inducing photographs will take your breath away",0
"mueller ain't going away",0
"drake's super bowl ad makes you wanna call someone on your cell phone",0
"report: mom would rather sit here and watch you guys have fun",2
"new poll finds 80% of americans would just fucking destroy pan of brownies",2
"if the us wants arabs as partners, we must treat them as such",0
"why a democrat is now blocking an obama nominee",0
"there's going to be a huge queer dance protest outside of ivanka trump's house",0
"here's the smart thing the nfl is doing to fix its dumb catch rule",0
"kate mckinnon kills as laura ingraham on 'saturday night live'",0
"god scores another free balloon some dumb kid let go of",2
"scientists discover eating serves function other than easing anxiety",2
"decorative throw pillow positively aching for a quick plump",2
"ross ice shelf embarks on world tour",2
"man takes free thing he doesn't want",2
"jedi chipmunks fight with lightsabers, universe wins",0
"inside amazon: wrestling big ideas in a bruising workplace",0
"progressive charter school doesn't have students",2
"mark zuckerberg: 'i regret' rejecting idea that facebook fake news altered election",0
"area cockroach fucking huge",2
"skywriter leaves suicide note",2
"u.s. cities aren't ready to fend off the next flint",0
"area man, woman each have thorough list of why they should break up on standby",2
"revised patriot act will make it illegal to read patriot act",2
"a museum in germany is asking designers to give peace a new sign",0
"doctors reveal dick cheney burning through at least 3 hearts each week",2
"eminem rips nra in a rap: 'they love their guns more than our children'",0
"in memory of the ms st. louis",0
"meet the other baldwin brother, james!",2
"sea lion rescued from santa barbara oil spill dies at seaworld",0
"unconditional love given to 15-year-old who just called mom a bitch in middle of hollister",2
"steven spielberg says netflix films shouldn't qualify for oscars",0
"4 high-level languages for front-end developers",0
"people with disabilities have a hard time finding jobs, and this company is doing something about it",0
"only positive statistic of year announced",2
"report: media coverage of bear attacks may be biased",2
"archaeologists: egyptian pyramids actually early attempt at camping",2
"congrats! you've been auto-enrolled -- now what?",0
"don lemon on sean spicer: everyone 'is dumber for having listened to that'",0
"explosion at fedex facility outside san antonio may be linked to austin bombings, fbi says",0
"chuck grassley is keeping details of his iowa events secret to avoid protesters",0
"celine dion served luxurious cat food in crystal goblet",2
"this prairie city deserves your travel dollars. here's why.",0
"obama to announce new climate change help for island nations",0
"paula jarrel's gps guide for expressing self compassion",0
"'no way to prevent this,' says only nation where this regularly happens",2
"miley cyrus' bangerz tour is coming to your living room tonight",0
"7 sweet treats for mother's day",0
"1/5 of u.s. adults live in or near poverty",0
"popular new amazon service just comes to your house and kills you",2
"drunken man careens wildly across internet",2
"hang-glider gang terrorizes elderly hot-air-ballooning couple",2
"all of the wacky and wonderful royal wedding memorabilia you can buy",0
"seaworld's new ad is completely full of it",0
"man builds 'star trek'-themed cabin out of junk",0
"breaking: israelites in sinai suddenly achieve freedom from pharaoh -- good times forecast",0
"this parody is for every parent whose kid hated taking pics with santa",0
"eleven-year-old has miniskirt, pumps, vague notion of what sex is",2
"the anti-gay right can't run forever from its history of bigotry",0
"us dietary guidelines: historic battle for people and planet",0
"muslim woman berated at heritage event speaks out on independence day",0
"rory feek says watching his daughter grow up better than a grammy win",0
"parents surprised cruel teen daughter hasn't pushed classmate to breaking point yet",2
"with police body cameras, d.c. mayor promises transparency with caveats",0
"leno to tell outrageous o.j. joke",2
"fbi quickly follows up on tip about potentially dangerous man who killed 17 in school shooting",2
"dickipedia: founder of bikram yoga",0
"philly cheesesteak either perfect or disgusting",2
"texas governor legalizes previously banned wrestling move",2
"this cfl player takes unsportsmanlike conduct to another level",0
"10 lies everyone tells you about paris",0
"cnn's ana navarro says michelle wolf's critics are acting like 'snowflakes'",0
"restaurant reacts perfectly to diners who were rude to employee with autism",0
"palin brushing up on foreign policy at epcot",2
"'the scream' returns from two-year vacation relaxed",2
"moderator asks candidates to be specific when describing hellscape country will become if they not elected",2
"quinoa black bean burger: layers of flavor and packed with protein",0
"mom hasn't said full, uninterrupted sentence to family since 1997",2
"stephen colbert nails the nra's complete hypocrisy in a single sentence",0
"it's been a really great year for poop bags",0
"why underwater homeowners won't be saved by bank of america's $17 billion deal",0
"conservative media throw virginia gop candidate under the bus after election loss",0
"an introvert's guide to throwing a solid holiday party",0
"nation breathes sigh of continuing unease",2
"travis kalanick takes leaves of absence from post as uber ceo",0
"nepal calls: part three",0
"miss france iris mittenaere wins miss universe crown",0
"scientists crack mystery of tiny traveling plants",0
"steve bannon's inflamed liver pulsing visibly through shirt during strategy meeting",2
"illinois neglects child care payments for needy families",0
"bill cosby mug shot released",0
"joe kennedy iii reveals how his gop counterparts really feel about donald trump's tweets",0
"boilermakers protest purdue's mascot",2
"fight kind of runs out of steam 15 seconds in",2
"black women are rising ─ when will our pay?",0
"state of emergency declared at new york city's housing authority",0
"conservationist known for exposing ivory & rhino trade stabbed to death",0
"new healthier menu features food wendy's customers bring from home",2
"can america be saved?: how did 'yes, we can!' become 'no, we couldn't'? (part one)",0
"#trybeatingmelightly shows pakistani women won't stand for wife-beating bill",0
"new envelope pushes envelope envelope",2
"the secret to speaking 'teen'",0
"mccain blasts obama as out of touch in burma-shave-style billboard campaign",2
"urban polling stations urge voters to immediately get back in line for general election",2
"fox news struggling to attract younger 60-75 demographic",2
"video game boss thinking he should get big glowing weak spot on back checked out",2
"senior pretty checked out during entire final year",2
"can caribbean cricket get its (political) groove back?",0
"'game of thrones' star reveals tormund's love for brienne extends off screen",0
"texas latinos overwhelmingly support abortion rights",0
"south syria ceasefire and the next israel-hizballah-iran war",0
"psychologists advise practicing words 'president trump' over next 2 months to prepare for inauguration",2
"'farm aid aid' concert to benefit struggling farm aid concerts",2
"cat likes it doggy style",2
"patriotic betrayal in the 1960s -- when the cia turned students into spies",0
"it's snowing in hawaii right now, and we can't wait to visit",0
"vatican issues first comments on trump's immigration ban",0
"new ad hammers trump as too impulsive to allow near the nuclear button",0
"read the full text of donald trump's executive order limiting muslim entry to the u.s.",0
"bush increasingly focused on how revisionist history will see him",2
"yahoo's newfront pulses to steve aoki's edm beat",0
"ctrl+ plus: a closer look at amc's halt and catch fire",0
"nation to wait for more facts on texas shooting before doing absolutely nothing about it",2
"the end of shared sacrifice set in stone: yale as metaphor",0
"man has story for every stain on pants",2
"man wishes there wasn't so much blank room on anniversary card",2
"romney campaign reboots for 72nd consecutive week",2
"senate bill may answer a decades-old request",0
"the peace process is dying at the hands of israel with help from hamas",0
"the 7 stages of potty training",0
"woman enters miss universe malaysia after finding beauty in her head-to-toe moles",0
"man accused of urinating on cop after yelling 'f*** trump'",0
"fifth-grader writes 'mrs. alan greenspan' all over her notebook",2
"ted cruz beats back donald trump in two states, shifting race",0
"kanye west scrubs entire twitter account of any mention of trump",0
"yes, trump has the power to launch a nuclear attack on his own",0
"live election coverage: watch as midterm results pour in",0
"mother constantly worried about son stationed on u.s. military base",2
"trump keeps citing a paris agreement study that seriously misses the point",0
"rupaul on trump: 'pardon me madame, but the emperor has no clothes!'",0
"donald glover's 'this is america,' through the eyes of a jim crow historian",0
"casual drink with acquaintance actually first move in elaborate chess game to get hired at united.com",2
"fellow millennial voters: no one owes us a damn thing",0
"obama peddling stimulus package door-to-door",2
"otto warmbier, u.s. student freed from north korea, has 'severe' neurological injury",0
"obama orders flags at half-staff to honor victims of oregon shooting",0
"fishing tycoon known as 'the codfather' will plead guilty to conspiracy and smuggling charges",0
"donald trump is unqualified to be president, majority of american voters say",0
"wrinkly, oversized trench coat returns to stage for 34th season with local community theatre",2
"man checks to make sure no one home before recording song into laptop",2
"here's why miley cyrus is my non-straight, non-binary role model",0
"researchers discover new source of airborne antibiotic-resistant bacteria",0
"high school won't allow gay student to receive scholarship at awards dinner",0
"an unexpected heirloom",0
"clinton's sight restored",2
"about that woman vp candidate: klobuchar works better than warren",0
"picture of iphone used as iphone wallpaper",2
"we're spending less on health care than we thought we would before obamacare",0
"at least 23 ethical issues are dogging epa administrator scott pruitt",0
"prince cremated, private ceremony held with family and friends",0
"9,000 animals rescued from 'worst torture operation' in the u.s.",0
