"mitch mcconnell reminds senators that they'll have to make up government shutdown days at end of year",2
"girl in park acts like it's no big deal she's wearing bikini",2
"area man guesses he'll learn the difference between shiites and sunnis",2
"everything you need to know about how stress affects your skin",0
"non-dominant hand completely botches nail clipping job",2
"woman who started sentence with 'oh my god' really needs to stick landing",2
"the feeling to ignore when you're on an emotional roller coaster",0
"the 12 colleges with the biggest sweet tooth, 2015 ranking by grubhub",0
"family impressed by extra effort father putting in to hide drinking",2
"fbi panicking after learning encrypted national security communications may have been intercepted by trump administration",2
"stop right now, this is the most precious beach town you'll ever see",0
"willow rented",2
"what gop hopefuls think of tom cotton's iran bombing claim",0
"from brothers to enemies: how syria's war has divided families",0
"white house now just holding continuous going-away party for departing staffers",2
"here's why hillary clinton's federal reserve plan is a big deal",0
"health reform at the crossroads: progress or peril?",0
"adorable puppy nets owner handjob",2
"mythbusters team struck down by zeus",2
"your heart is probably older than you think, cdc warns",0
"mila kunis sold unlicensed boyband t-shirts on the side while filming 'that 70s show'",0
"kerry vows to raise wife's taxes",2
"why the moms who love aunties are amazing, too",0
"trailblazing colleague makes historic contact with people who work on other floor",2
"court summons comes with 1,025 free hours of aol",2
"candlelight vigilante takes commemorating into own hands",2
"why political losers tell us more about american politics than the winners",0
"prayers answered by random series of events in cold, uncaring universe",2
"gisele bündchen makes history with a makeup-free vogue italia cover",0
"terry jones - could have at least manned up and burned one koran",2
"mitch mcconnell says americans won't tolerate democrats blocking supreme court nominations",0
"rick santorum blames absent dads and broken homes for mass shooters",0
"gchat status disastrously left on visible during peak andrea hours",2
"2014 olympics to be held in 19th century",2
"following the money: energy dollars hard at work on capitol hill",0
"woman knew ever since age 40 she didn't want children",2
"inflatable chair's novelty wears off",2
"receptionist takes leave of absence citing dehydration, exhaustion",2
"tracee ellis ross looks like an angel in this playfully sheer gown",0
"is my special child being bullied?",0
"poll finds majority of americans approve of child labor laws but agree that kids carrying briefcases would be cute",2
"mike pence breaks out formal altar boy robes for state of the union address",2
"clint dempsey talks world cup, jurgen klinsmann and the pressures facing team usa",0
"dad immediately develops deep friendship with guy giving quote on replacing windows",2
"yoga for the heart",0
"internal affairs investigator disappointed conspiracy doesn't go all the way to the top",2
"wendy's new homestyle chicken strips salad shamelessly touted",2
"stephen colbert introduces the hilarious alter egos of donald trump's cabinet",0
"nordstrom stopped carrying ivanka trump because no one was buying it",0
"burger king looks open",2
"learn how to troll trump so hard that he blocks you in this masterclass parody",0
"man just having one of those decades where he doesn't feel like doing anything",2
"how a mom's behavior might be alienating her teen daughter",0
"poll: some would choose 'meteor hitting the earth' over trump or clinton",0
"visible panty line discussed like it's cancer",2
"'we can have differences of opinion and still respect each other,' says betrayer of the one true cause",2
"on alan turing, me and my son",0
"struggling don rickles has nothing but nice things to say about audience",2
"brad pitt and the kids fill in for angelina at 'unbroken' premiere",0
"company hosts fun night for employees to get drunk and complain",2
"'1984' sales spike after kellyanne conway's orwellian interview",0
"health officials confirm second case of plague from yosemite",0
"john oliver has a heartfelt message for orlando",0
"breaking: everyone at bar cooler than area man",2
"kim kardashian's resemblance to cher for halloween is truly uncanny",0
"watch: what it feels like after you wolf down 69 hot dogs in 10 minutes",0
"trump won't endorse paul ryan or john mccain",0
"report: some small town enjoying last days of anonymity before harrowing tragedy",2
"billionaire cash is flooding los angeles to push trump-devos school choice agenda",0
"area man no longer playing up resemblance to kevin spacey",2
"why female police officers are increasingly speaking up about pregnancy discrimination",0
"tennis legend althea gibson to be honored with statue at u.s. open site",0
"popsicle reintroduces beloved 'plain' flavor",2
"man offered cocaine by guy he met at urinal 90 seconds ago",2
"dad not going to pay someone to fix marriage when he can do it himself",2
"become who you are: the world's first legally recognized cyborg may be onto something",0
"why carly fiorina's presidential run makes sense -- and is pure folly",0
"women's strike a sobering reality check for subway masturbator",2
"women have a tougher time recovering from heart attacks. here's why",0
"beekeeper slowly becoming bee hoarder",2
"report suggests stalin was just one great purge away from creating communist utopia",2
"the ebola fighters 'time' forgot",0
"bashar al-assad tries tiny bit of sarin gas on self to see what it's like",2
"5 foolproof muffins to kick off baking season",0
"this is why the beyhive is mad at emma watson",0
"this gif sums up the impact of addiction and mental illness on america",0
"hm, i wonder what mark zuckerberg's up to on facebook right now",0
"chelsea and ivanka put their friendship on ice",0
"woman in coffee shop judges a record 147 people",2
"a constitutional scandal worse than iran-contra or watergate",0
"25 stunning snaps to kick off wedding season",0
"don't rely on your fitness tracker to lose weight",0
"16 valentine's day jewelry ideas for girlfriends who hate corny stuff",0
"alignment of 6,071 completely independent variables necessary for man to feel okay",2
"the global empowerment of the next generation",0
"hanes apologizes, pulls t-shirts from shelves after seeing how local man looks in them",2
"conrad bain steps down as national kitsch-reference laureate",2
"george takei reminds donald trump of the past horrors of nuclear weapons",0
"cameron diaz finally opens up about generally positive experience in show business",2
"huffpollster: americans see progress, room for improvement on voting rights",0
"creators of michelle rodriguez's new film defend it from claims of transphobia",0
"universal patents a wand and spells ride that sounds perfect for a new harry potter attraction",0
"frozen tundra of emptiness stretching out forever and ever weighed against date with mike4763",2
"secretary masks deep depression with laughter during office banter",2
"huffpost rise: what you need to know on february 10",0
"regular citizen heroically enforces park's 'no glass containers' rule",2
"teen gives up smoking pot after seeing parents high",2
"longtime refugees grateful for citizenship in tanzania",0
"secretary of education under investigation for falsifying hall passes",2
"congolese rebel can't bring himself to care about congolese war",2
"the end might be near for brick and mortar black friday",0
"the sixth season of 'downton abbey' will reportedly be its last",0
"hillary clinton and bernie sanders vie for california's support",0
"new archaeological find suggests mary magdalene was actually a size 12",2
"driving instructor has own gas pedal in case student total pussy",2
"donald trump to begin fundraising 'right away'",0
"alcohol-themed bar opens",2
"local radio station has got some doobie brothers coming up for you",2
"greenspan just repeating detractors' criticisms in high-pitched girly voice",2
"how to stand your ground in a world full of mean girls",0
"the best rooftop bars in the u.s.",0
"ireland's spirits and spirits in the 2014 ford fusion energi",0
"presidential candidates react to paris attacks",0
"prosecutor tells black congressmembers the war on drugs isn't racist",0
"'homosexuality is not an addiction'",0
"rick perry's mugshot might be a money maker",0
"mass graves suggest systematic killing of rohingya in myanmar",0
"baby found on doorstep moved to neighbor's doorstep",2
"john legend speaks out against trump's syrian refugee and travel ban",0
"putin learns putin behind plot to assassinate putin",2
"chris christie, mike huckabee bumped from main gop debate",0
"hands-off mom lets kids create own psychological issues",2
"jennifer aniston takes rare selfie for the best possible reason",0
"paula poundstone still famous",2
"montana judge targeted for impeachment for 60-day incest rape sentence",0
"lone ant crawling through kitchen trumpets arrival of horde",2
"grizzly bear sprained paw while mauling hunter, reports ranger",2
"one woman, two proposals, dumbfounding indecision",0
"elizabeth warren slams pat toomey for trying to let banks 'swindle' cities and towns",0
"degrees not debt",0
"millions participate in cuban version of survivor",2
"john boehner: we should know if paul ryan is running for speaker soon",0
"courtroom sketch artist has clear manga influences",2
"jeff goldblum says he was almost the voice of apple",0
"report: overseas sweatshops hurting u.s. sweatshops",2
"jimmy buffett pays for own drink for first time in 17 years",2
"10 places to have a 'frozen' vacation",0
"dad and toddler 'compete' over mother's day responsibilities",0
"dear america, it gets better. love, north carolina",0
"want to live to 102? here's how.",0
"americans hopeful this will be last mass shooting before they stop on their own for no reason",2
"mom gets last new hairstyle",2
"'octopussy' villain louis jourdan dead at 93",0
"protests over police violence spread around u.s.",0
"samsung slashes profit forecast after pulling plug on note 7 smartphone",0
"11 comedians playing comedians on tv",0
"the only shopping guide for cyber monday you need",0
"the internet is having a field day comparing justin bieber and orlando bloom's nude pics",0
"local man foremost expert on what the terrorists should do if they really want to hurt us",2
"iggy azalea lands small movie role",0
"l.l. bean's ceo offers to help workers affected by trump's travel ban",0
"the u.s. is driving less and still building more highways",0
"new study finds link between cancer, reading text on computer screen",2
"facebook outreach tool ignores black lives matter",0
"why i'm not leaving florida (yet)",0
"man anxiously scanning bar's reaction to jukebox selection",2
"huffpost rise: what you need to know on june 9",0
"woman shot by former boyfriend at chicago nordstrom store dies",0
"treasure hunters discover wreck of 18th-century carnival cruise ship",2
"passengers 'lashing out' at scott pruitt justify first-class travel, new epa memo says",0
"nancy pelosi: donald trump cannot be 'casually loose-lipped'",0
"thing in cave not finished with eric yet",2
"faa assures public: air travel 'pretty safe'",2
"house lawmakers brainstorming some good things to say about poor people before meeting pope francis",2
"rnc taps dennis hastert to lead new youth outreach program",2
"man has trouble growing full beard of bees",2
"leadership and transparency 2015: the social media imperative",0
"'who makes the game?' donald sterling certainly asked the right question",0
"trevor noah skewers betsy devos with fake for-profit university ad",0
"if ya can't beat 'em, screw 'em: north carolina governor signs bills gutting successor's power",0
"another opportunity",0
"why hillary clinton is moving left on every issue except israel - opinion",0
"the senate's stealth raid on seniors' health care",0
"everything you need to know about mike kelley",0
"peter dinklage might've spit his gum into wife's mouth before accepting his emmy",0
"philip morris: 'please talk to your cooler children about cigarettes'",2
"final harry potter book blasted for containing spoilers",2
"want to make a difference? don't be a hedge fund manager",0
"things you say in emails vs. how you look typing them",0
"president urges calm, restraint among nation's ballad singers",2
"'what was he wearing?' why the media needs to ask the right questions about rape and violence",0
"facebook vows not to hand over users' medical records to government",2
"'luck' producers still killing a lot of horses",2
"exhausted doctor to wake up early, finish surgery in morning",2
"trump again proves his claim about waiting for 'facts' after charlottesville was garbage",0
"18 alternatives to those played-out dorm-room posters",0
"world doesn't even know who to admire anymore after tom hanks murders 5",2
"'jane the virgin' narrator creates a hero for latinos who feel 'trapped' in a conservative culture",0
"transgender lawmaker danica roem: trump shows there's 'no barrier' to getting elected",0
"85-year-old russian stares at cement wall of room",2
"emma watson donates $1.4 million to fight sex harassment in curtain raiser to baftas",0
"dozens of black-rubber-clad masochists line up outside capitol for paul ryan's job",2
"spider sitting on shower wall can't wait to see look on man's face",2
"maría tomás-keegan's gps guide for lifting yourself up",0
"deadly clashes erupt as venezuela holds widely boycotted election",0
"donald trump suggests colin kaepernick 'find a new country' after national anthem protest",0
"we got the exclusive look at hillary's dnc speech notes",0
"former trump ethics director calls arpaio pardon 'a harbinger of worse to come'",0
"jake tapper's grim reminder: steve bannon isn't the problem. trump is.",0
"john kasich admits he's against d.c. statehood because it would give democrats more votes",0
"university admits chocolate milk doesn't alleviate effects of concussions",0
"2" x 2" vegetarian section granted on backyard grill",2
"mike bloomberg apologizes for giving his top political journalists a watergate-era nickname",0
"stoned extraterrestrial stumbles across hidden message after listening to golden record backwards",2
"the reclusive billionaire bankrolling ted cruz",0
"what makes for a stable marriage?",0
"report: majority of nation's civic engagement centered around oppressing other people",2
"trevor noah grills chris christie on fedex immigrant tracking proposal",0
"tired and poor need not apply: the american dream is not for you",0
"as global policy moves to expand digital rights, u.s faces crucial fight over equal access to the internet",0
"missing alaska family died in murder-suicide: police",0
"polio could be stopped worldwide by year's end, says gates foundation",0
"city terrorized but unimpressed by serial killer who just shoots victims",2
"when i own my sexuality, will i need queer visibility any less?",0
"report: most effective marketing technique still giving out little versions of product",2
"rihanna's low-cut red gown is a wardrobe malfunction waiting to happen",0
"5-minute hairstyles -- for real!",0
"behind peter thiel's plan to destroy gawker",0
"trump's not-so-new afghanistan strategy",0
"michelle duggar opens up about teenage struggle with bulimia",0
"pope celebrates mass in havana, warns against dangers of ideology",0
"guatemalan earthquake registers 0.3 on area man's consciousness",2
"sunday roundup",0
"sole remaining lung filled with rich, satisfying flavor",2
"watch dirt bikers get a bit too close to nature",0
"new netflix gas lets users inhale multiple seasons of tv shows",2
"vulture feeling nauseous after eating bad rotting deer carcass",2
"are you present and mindful -- is your 'inner baby monitor' on?",0
"3 months after the hurricane, one-third of puerto rico's power is still out",0
"congress passes 34th short-term funding patch for highways",0
"man with stupid breaks off co-dependent relationship",2
"police audio leaked in killing of unarmed black teen christian taylor",0
"4 super easy ways to keep cyber criminals out of your life",0
"emma thompson thinks there are many more harvey weinsteins in hollywood",0
"asshole from plane greeted at baggage claim by whole family",2
"27 delicious ways to do a vegan holiday feast",0
"donald trump: pulse attack 'wouldn't have happened' if 1 person had been armed",0
"'very special' stone age axe discovered",0
"watching thousands march in his honor unlocks deeper, darker corner of trump's psyche",2
"obama returns from paris climate talks with couple energy-efficient light bulbs",2
"evolutionary biologist discovers common human ancestor at cousin's wedding",2
"alligator and python locked in death duel on golf course",0
"congress allocates $90 million to protect remaining eagles members",2
"clinton receives 400,000 honorary degrees for college commencement speech",2
"unhappy: an excerpt from 'shitfaced: musings of a former drunk'",0
"chartering the 90 miles: millennials in cuba and the u.s.",0
"britney and her sons cover people magazine",0
"after careful thought, teen applies to college where family donated building",2
"completely out-of-control cell phone nearly vibrates itself off table",2
"helicopter ride pretty much delivers the goods",2
"sick dog who was to be euthanized gets diagnosed just in time",0
"stormy daniels' lawyer taunts trump: michael cohen will 'fold like a cheap deck of cards'",0
"bush's 'electability' argument is getting even weaker",0
"billy crystal reprises his 'city slickers' role to enter 'westworld'",0
"man made clear-headed choice to upload series of online videos explaining how to install surround sound speakers",2
"parrot's previous owner obviously watched a lot of the price is right",2
"santa fe high schoolers held gun violence protest 1 month before shooting",0
"9-pound infant barrels way down birth canal",2
"lucid dreaming: new horizons for research",0
"e. coli outbreak linked to chipotle spreads to 3 more states",0
"bush dragged behind presidential motorcade for 26 blocks",2
"15 shot in chicago on sunday",0
"steady job growth is still not boosting workers' pay, new numbers show",0
"hillary clinton to release 2015 tax returns within days, criticizes donald trump",0
"students punished for sexual assault should have transcripts marked, title ix group says",0
"dept. of transportation to replace highway mile markers with dead raccoons",2
"dnc attendee screaming 'the earth needs us!' to no one in particular",2
"friend insists you just have to climb ladder, hop gap, scale wall to see the view from apartment's roof",2
"wall wishes it were load-bearing",2
"entirety of hollywood film industry replaced with 40,000 christopher plummers",2
"apple announces new iphone with n-word on back knowing customers will buy it anyway",2
"study: support for bill of rights highest while attempting to talk way out of drunk driving arrest",2
"nevada must not allow a death row inmate to 'volunteer' for execution by fentanyl and other drugs",0
"man failing to heed harsh lessons of past orders sonic bacon cheeseburger toaster",2
"the crisis with russia and the unspoken link",0
"'what if no one travels anywhere ever again?' wonders panicked transportation secretary",2
"breakup doesn't seem to have changed relationship",2
"the intersection of race, class and the constitution: kalief browder",0
"what makes fireflies light up? here's the whole story",0
"during the debate, these two did the unthinkable and united the country",0
"learning resilience from a master",0
"good girls have abortions, too, naral chief tells dnc",0
"retire! dance! die! but first, pass the chocolate. boomers according to google",0
"brody jenner throws shade at kimye in 'kuwtk' teaser",0
"see photos from the 2015 white house correspondents' dinner",0
"friday's morning email: trump: 'i thought it would be easier'",0
"nobody watched matthew mcconaughey's forgotten youtube channel until now",0
"roommate, girlfriend never seem to have sex",2
"struggling us airways introduces $100 million bomb fee",2
"google's 9/11 homepage design stirs controversy",2
"what our grieving family needs from loved ones this holiday season",0
"privileged little artiste writing something oh-so-precious into his moleskine notebook",2
"tennessee senate passes a bill to erect a memorial to 'victims of abortion'",0
"what #digitalhealth can learn from the fight against hiv/aids",0
"new mayor drives around in giant snail car",0
"l'oréal releases new line of makeup specifically for men to wear when wives not home",2
"tenants forced to clean apartment before telling landlord about mice",2
"to raise the voice in view of the massacre in gaza",0
"everything that's wrong with business in america given promotion",2
"police finally make breakthrough in decades-old marijuana possession cold case",2
"charlize theron hired to ride struggling cleveland light rail system monday through friday",2
"former refugee fights for her dream to abolish female genital mutilation in somalia",0
"10 instagram accounts to follow to get you in the holiday spirit",0
"early-morning jogger pities everyone still sleeping",2
"priest religious, but not really spiritual",2
"fordham, education department sued over student's mental health records",0
"chuck schumer warns trump not to ruin budget talks by getting involved",0
"mcdonald's announces new spearmint after-dinner big mac",2
"bush torture defender suggests obama should be impeached over bergdahl",0
"salad rendered unhealthy in three steps",2
"mass die-off of dolphins directly linked to deepwater horizon spill",0
"i misplaced my fancy camera on assignment in peru, but my iphone saved the day",0
"warm, syrupy pleasure coursing through man's veins after big hit of mattress",2
"get clarity on what the future holds so you can go back to worrying about costume ideas.",2
"historical archives: a salt cake recipe",2
"made in the image of god: art, feminist theology and caroline mackenzie",0
"the crocodile and the scorpion",0
"bill gates finally getting into radiohead's kid a",2
"baby-shower attendees quickly drain box of white zinfandel",2
"hillary's last ditch effort - the final speech",0
"ava duvernay on trump's america: 'art will be our weapon'",0
"historians discover thomas jefferson may have secretly fathered multiple other countries",2
"real-life grinch celebrates 'hanukkah'",2
"people's climate march in lima unites citizen voices of the americas",0
"furious maitre d' can only assume hostess didn't realize she was addressing everlast",2
"area man disappointed in self for already being full",2
"report: employers know within first 5 minutes of job interview whether they will murder applicant",2
"proof that it pays to piss off sarah palin",0
"here's christine baranski watching trump's inauguration on 'the good fight'",0
"pre-teen moves from giggling-at-everything phase to never-smiling phase",2
"selena gomez tears up while performing tribute to christina grimmie during concert",0
"liberal male hypocrisy, modern day rasputins and the culture of deceit",0
"powerful senate committee concludes russia tried to sow chaos in 2016 elections",0
"couple discovers shop that sells cakes",2
"fat shaming can literally break your heart",0
"real-life stranger on a train less interesting than hitchcock version",2
"these stunning photos capture the loneliness of insomnia",0
"kristen wiig crashes bill hader's 'snl' monologue",0
"praia de iracema is the place you should have been this week",0
"amazon lashes out at competitors, banning apple tv and chromecast",0
"miss north dakota cara mund is crowned state's first-ever miss america",0
"man surprised to learn high school classmate became completely different type of fuckup",2
"why bernie sanders and donald trump won the michigan primaries",0
"the u.s. can't afford to continue the death penalty",0
"koch network spent nearly $400 million in 2015",0
"new mexico store bans 'obama & other muslims'",0
"local couple celebrates birth of son with ritual genital mutilation",2
"marine hopes to spend second tour of duty on different baghdad city block",2
"exhibitionist zoo elephants waiting for crowd to gather before screwing",2
"verizon introduces new charge-you-at-whim plan",2
"cameron diaz says she's 'actually retired,' so there",0
"3 tips for coping with grief during the holidays",0
"jessica simpson is a vision in blue on date night with husband eric johnson",0
"survivalist sentenced to death for murder of pennsylvania state trooper",0
"5 years of progress: time for patients over politics",0
"report: crooked border guards planting illegal immigrants in cars",2
"5 types of web content for driving extra traffic",0
"dad finally found in front of tvs at sears",2
"evangelical leaders release anti-lgbtq statement on human sexuality",0
"lax supervision plagued officer sex cases, ap investigation finds",0
"dear rolling stone, not all canadians are in love with justin trudeau",0
"'no way to prevent this,' says only nation where this regularly happens",2
"time to defund the diet industry?",0
"these vintage ads prove we had no idea what the future would actually look like",0
"er doctor secretly thinks of self as ward's george clooney",2
"on-line gambling too depressing to even think about",2
"man who encourages child's destructive id referred to as 'good with kids'",2
"physicist brings in particle from home he's been meaning to accelerate",2
"report: ground still least desirable surface for breaking fall",2
