File:,"../Sarcasm/Sarcasm_train_set_1.csv"
"why the story of muhammad ali's rebellion matters today: part 4",-1,-1,MATCH
"nra's top lobbyist implies trump is back on its side",-1,-1,MATCH
"women's soccer star says u.s. team is 'fighting for bigger picture' equality",-1,-1,MATCH
"bush calls cabinet meeting to get story straight",1,1,MATCH
"amish woman knew she had quilt sale the moment she laid eyes on chicago couple",1,-1,FAIL
"local man gets cocky with ladder",1,1,MATCH
"my secret money life: i helped bankroll my brother -- and came to regret it",-1,-1,MATCH
"melania trump responds to charlottesville clashes before president does",-1,-1,MATCH
"monster truck escapes",1,-1,FAIL
"kasparov de-rezzed",1,-1,FAIL
"ohio mom thanks kind cashier who cheered up her 3-year-old son",-1,-1,MATCH
"baltimore civil unrest puts my college concerns in perspective",-1,-1,MATCH
"rapper french montana launches campaign to help dreamers go to college",-1,1,FAIL
"peaceful protest interrupted by swarm of aggressive black-clad militants",1,1,MATCH
"this hummus has a secret ingredient supermarkets don't want to sell",-1,-1,MATCH
"huckabee sanders warns stormy daniels' disclosures just steamy, sexy distraction from real issues",1,-1,FAIL
"newlywed britney spears hangs bloody sheet in window for reporters",1,-1,FAIL
"guy at bank has weird hair for guy who works at bank",1,1,MATCH
"heirloom plasticware lovingly handed down to next hundred thousand generations",1,1,MATCH
"democratic response to trump speech highlights party's struggle moving forward",-1,-1,MATCH
"drew brees' foot injury didn't happen overnight",-1,-1,MATCH
"bombing in syria's ghouta won't let up long enough for rescuers to count bodies",-1,1,FAIL
"they accused him of taking a backpack. the courts took the next 3 years of his life.",-1,-1,MATCH
"kennel certificate proves who puppy daddy is",1,-1,FAIL
"woman who drinks 6 cups of coffee per day trying to cut down on blue light at bedtime",1,1,MATCH
"jury finds cinemark theater chain not liable in 2012 colorado movie massacre",-1,1,FAIL
"polly zehnder-swader's gps guide for unwinding after a bad day",-1,-1,MATCH
"sheryl sandberg doesn't think fake news on facebook influenced the election",-1,-1,MATCH
"gop candidates offered cash voucher to give up spot and participate in later election",1,-1,FAIL
"parents create hilarious cards for the less celebrated baby milestones",-1,-1,MATCH
"earliest known t-shirt found",1,-1,FAIL
"who pushes for more 'ouchless' adhesive funding",1,-1,FAIL
"biden's handlers suggesting he forget the words 'pink' and 'stink' altogether",1,-1,FAIL
"another english king could be buried under a parking lot",-1,-1,MATCH
"parents considering second child so daughter can have someone to grow apart from",1,1,MATCH
"these photos show the strength of students as they protest gun violence",-1,-1,MATCH
"exhausted john kelly parks president in front of episode of 'tucker carlson' to get quick hour to himself",1,1,MATCH
"7 mistakes leaders make that make everyone miserable",-1,-1,MATCH
"senate candidate takes heat for implying obama supports her opponent because she's black",-1,-1,MATCH
"our homes, ourselves and creating the perfect stress-free environment",-1,-1,MATCH
"on any given day we simply don't know what trump we'll be getting",-1,-1,MATCH
"u.s. allies line up for exemptions from trump's tariffs",-1,-1,MATCH
"disturbing fast food truth not exactly a game-changer for impoverished single mom of 3",1,-1,FAIL
"isis laid booby-traps all over mosul to kill, injure returning civilians",-1,1,FAIL
"area man has own version of neighborhood-watch program",1,1,MATCH
"busy schedule forces vladimir putin to move up election win a couple days early",1,-1,FAIL
"chrissy teigen gives the middle finger to her pregnancy critics",-1,-1,MATCH
"medicare should cover hearing aids",-1,-1,MATCH
"jennifer lawrence stuns in oscar de la hoya gown",1,-1,FAIL
"oil train derails, spilling crude in columbia river gorge",-1,-1,MATCH
"with a little luck, trump and his cronies will disrupt their own plans",-1,-1,MATCH
"is jeb's mulligan on iraq convincing or a tar baby he can't escape?",-1,-1,MATCH
"commuter playing some sort of alphabet sudoku",1,1,MATCH
"trump's fbi attacks are helping accused terrorists defend themselves in court",-1,-1,MATCH
"video shows mom kicking child out for voting for trump in mock election",-1,-1,MATCH
"a drug company is putting work-life balance before profit. cool.",-1,-1,MATCH
"pele hospitalized for back surgery",-1,-1,MATCH
"improving the lgbt experience within the workplace",-1,-1,MATCH
"i can't do this anymore, congress. i can't.",-1,-1,MATCH
"drunk driver falls asleep on busy highway: cops",-1,-1,MATCH
"saddam hussein presents suicide bomber's family with oversized check",1,1,MATCH
"officers fired excessive number of shots at bank robbers: report",-1,-1,MATCH
"this 2-year-old has a lifetime's worth of perfect halloween costumes",-1,-1,MATCH
"cnn holds morning meeting to decide what viewers should panic about for rest of day",1,-1,FAIL
"underprotective father demands daughter arrive home by 10 a.m.",1,-1,FAIL
"few years in military would have really straightened out troubled teen killed on first tour of afghanistan",1,1,MATCH
"new honda commercial openly says your kids will die in a car crash if you buy a different brand",1,-1,FAIL
"democratic scouts head to tampa to get closer look at mitt romney",1,1,MATCH
"'today' anchors wear 'charlie brown' costumes for halloween",-1,-1,MATCH
"trump's evangelical advisors urged him to protect dreamers",-1,-1,MATCH
"david letterman on why he doesn't care that much about television anymore",-1,-1,MATCH
"woman who doesn't use facebook completely out of touch with friends' prejudices",1,1,MATCH
"cooking off the cuff: italian rice and sausage (let's not call it risotto)",-1,-1,MATCH
"dzhokhar tsarnaev courtside at pacers-heat game",1,-1,FAIL
"google chooses saving lives over profits in the midst of opioid epidemic",-1,-1,MATCH
"nra lobby warns congress not to try anything stupid",1,1,MATCH
"coworker who went to gym this morning a chipper little fucker",1,-1,FAIL
"stephen colbert mocks lawmakers for talking porn instead of guns",-1,1,FAIL
"second nintendo controller sits unused",1,-1,FAIL
"street musician's mother really on his case about practicing his buckets",1,-1,FAIL
"do not bring your kids to 'measles parties,' doctors warn",-1,-1,MATCH
"in kenya's forbidden forests, conservation can turn violent",-1,-1,MATCH
"part written specifically with sylvia saint in mind",1,-1,FAIL
"we count, so count us: three reasons it's important to collect census data on lgbtq people",-1,-1,MATCH
"chagas disease: a 2014 world cup yellow card",-1,-1,MATCH
"this is what 2015 will look like according to 'back to the future'",-1,-1,MATCH
"grassroots activists are leading the way on the addiction crisis",-1,-1,MATCH
"will ferrell reprises his role as george w. bush for samantha bee",-1,-1,MATCH
"director scott schwartz takes on disney's hunchback",-1,-1,MATCH
"eddie murphy receives mark twain prize at kennedy center",-1,-1,MATCH
"over 50% of lgbtq youths struggle with eating disorders, survey finds",-1,1,FAIL
"security guard can't afford to relax for so much as six hours",1,1,MATCH
"most people will have a mental health condition at some point",-1,-1,MATCH
"president obama: pretty sure jesus isn't cool with the drones",-1,-1,MATCH
"donald trump's health secretary pick literally ran away from birther question",-1,-1,MATCH
"this republican once said helping refugees made us a 'better nation.' but now he's done.",-1,-1,MATCH
"bernie sanders requests kentucky primary recanvass",-1,-1,MATCH
"5 missing after army helicopter downed near hawaii",-1,-1,MATCH
"faith leaders join the fight for lower payday loan rates",-1,-1,MATCH
"blogger praises k-beauty while calling asians 'ching chongs' in 'funny clothes'",-1,-1,MATCH
"commerce secretary urges nation to get in on piece of the action",1,1,MATCH
"nancy reagan available at 82",1,-1,FAIL
"lgbt rights rally in deeply-divided singapore sees record turnout",-1,-1,MATCH
"clinton becomes first president to clear 18 feet in pole vault",1,-1,FAIL
"'i promise to work tirelessly to achieve my campaign's goals,' threatens trump in terrifying address",1,-1,FAIL
"what europe can teach us about trump",-1,-1,MATCH
"discovering the pink petticoat, tampa's lingerie treasure trove",-1,-1,MATCH
"argument about capital of australia occurs 10 feet from encyclopedia",1,-1,FAIL
"mozambique devises national plan to end child marriage",-1,1,FAIL
"cia torture's immeasurable damage to u.s. global leadership",-1,-1,MATCH
"6 new year's resolutions that don't take all damn year to accomplish",-1,1,FAIL
"nobel prize awarded to man who helped humans have more fucking babies",1,1,MATCH
"twitter is a more comfortable place for perpetrators than it is for sexual violence survivors",-1,-1,MATCH
"police fatally shoot black man in san diego suburb, sparking protests",-1,-1,MATCH
"pope francis carves roast cherub for vatican christmas dinner",1,-1,FAIL
"creationism banned from uk schools",-1,-1,MATCH
"ceo unveils bold new plan to undo damage from last year's bold new plan",1,1,MATCH
"kitchen staff warned not to make fun of regional manager",1,1,MATCH
"woman spends entire date wondering if this the one she'll mace",1,-1,FAIL
"revealing spring attire reminds man he nothing more than weak, hormonal ogre",1,1,MATCH
"in the weeks before trump takes office, obama's mad dash to save public lands",-1,-1,MATCH
"dude with knit hat at party calls beer 'libations'",1,-1,FAIL
"years of living dangerously takes on climate denial, anti-science attacks on climate solutions",-1,-1,MATCH
"zimbabwe's youth defy blackout to organize protests on social media",-1,-1,MATCH
"confronting isil: the day and decade 'after'",-1,-1,MATCH
"moviegoer manages to sneak candy past teenage usher earning $7 an hour",1,-1,FAIL
"300 million without electricity in india after restoration of power grid",1,-1,FAIL
"italian recipes that are oldies but goodies",-1,-1,MATCH
"report: clinton accepted rebate while in office depot",1,1,MATCH
"illiterate spirit frustrates ouija- board players",1,-1,FAIL
"informal tone of cover letter sets job applicant apart from seriously considered candidates",1,1,MATCH
"mom hasn't ordered favorite pizza topping in over a decade",1,-1,FAIL
"miss nude america loses title after appearing clothed in woman's day",1,-1,FAIL
"family has strict no smartphone rule while eating dinner in front of tv",1,1,MATCH
"mark hamill shuts down trump's latest complaint with 3 blistering words",-1,-1,MATCH
"nonessential government employee gets back to work",1,1,MATCH
"man adds a few personalized tracks to standard new-girlfriend mix cd",1,1,MATCH
"south dakota asked to water north dakota's crops over the weekend",1,-1,FAIL
"nation offsets carbon footprint by planting single 300,000-foot-tall tree",1,1,MATCH
"can machines really learn?",-1,-1,MATCH
"man runs into ex-wife while wearing sandwich board",1,1,MATCH
"watch this artist carve a watermelon into the night king from 'game of thrones'",-1,-1,MATCH
"gisele bundchen dons a nude bodysuit",-1,-1,MATCH
"kiddie pool falls into disrepair",1,1,MATCH
"'any song can be sad if it has sad memories attached to it,' report newly single sources",1,1,MATCH
"a knicks' fan's open letter to santa",-1,-1,MATCH
"hiker dies after falling from yosemite's iconic half dome trail",-1,-1,MATCH
"romney spends day tearfully apologizing at father's grave",1,-1,FAIL
"what's better, fresh or frozen turkey?",-1,-1,MATCH
"why dave brandon won't be michigan's athletic director next year",-1,-1,MATCH
"how to make norwegian skillingsbolle (cinnamon buns)",-1,-1,MATCH
"fat kid just wants to watch you guys play",1,-1,FAIL
"israelis and palestinians at harvard: part 9 of 9",-1,-1,MATCH
"trump suffering horrible indigestion after eating fresh, well-prepared state dinner meal",1,-1,FAIL
"considering self-employment? 7 questions to ask yourself",-1,-1,MATCH
"epa didn't know anybody was still drinking water",1,-1,FAIL
"matador fatally gored after he trips on cape in french bullring (warning: graphic video)",-1,1,FAIL
"jerked around after all these years",-1,-1,MATCH
"hyperrealistic drawings ask viewers to take a closer look at homeless communities",-1,-1,MATCH
"we waited 36 years to get married, and the judge made all the difference",-1,-1,MATCH
"private vehicles beat ambulances in saving gunshot and stabbing victims",-1,-1,MATCH
"showdown with johnson & johnson's alex gorsky",-1,-1,MATCH
"watch: what it's like to identify as asexual",-1,-1,MATCH
"new star wars trailer debuts tonight as advance sales smash records",-1,-1,MATCH
"widespread power outage strikes detroit",-1,-1,MATCH
"egypt plunges into state of middle east",1,1,MATCH
"man who enjoys thing informed he is wrong",1,1,MATCH
"saudi executioner thinks he pulled something in shoulder during last 10 decapitations",1,1,MATCH
"god getting strong urge to bring back dinosaurs",1,1,MATCH
"why i won't be at pride this year, in one long rant",-1,-1,MATCH
"pit bull had lost all hope when kids found him in the grass",-1,-1,MATCH
"podcast: students say 'we don't want to become robots'",-1,-1,MATCH
"lucrative new oil extraction method involves drilling directly into gas stations",1,1,MATCH
"drunken episode a repeat",1,-1,FAIL
"3 ways broadband internet is improving health care and education",-1,-1,MATCH
"mila kunis calls out trump's controversial views on immigration",-1,-1,MATCH
"daniel tosh chuckles through own violent rape",1,1,MATCH
"job applicant blows away interviewer with intimate knowledge of company's 'about us' page",1,1,MATCH
"'game of thrones' star maisie williams claps back at sexist headline",-1,1,FAIL
"russell crowe reacts to death of john nash, 'a beautiful mind' mathematician",-1,1,FAIL
"new orleans adopts $10 cover charge",1,1,MATCH
"sharon's neurotransmitters reach cease-fire agreement",1,-1,FAIL
"ruh-roh! runaway 'mystery machine' takes police on high-speed chase",-1,-1,MATCH
"poll: duckworth lead over kirk shrivels",-1,-1,MATCH
"area telemarketer awash in sea of human misery",1,1,MATCH
"taylor swift left nashville a long time ago folks",-1,-1,MATCH
"see two spirits wave hello in the funniest scene from 'a ghost story'",-1,-1,MATCH
"ups guy hasn't heard a doorbell like that one in a while",1,1,MATCH
"bid to save gawker.com falls short",-1,-1,MATCH
"here's why huffpost is dropping polls that rely only on landlines",-1,-1,MATCH
"are introverts or extroverts happier?",-1,-1,MATCH
"classic movie 'avatar' updated for today's audiences",1,-1,FAIL
"amazon fires warehouse worker who took unauthorized breath",1,-1,FAIL
"tracy k. smith is america's new poet laureate",-1,-1,MATCH
"berserk hairdresser cuts bangs without permission",1,-1,FAIL
"local teen quits club that would've been tiebreaker in admission to dream school",1,1,MATCH
"daryl dixon's big secret is finally revealed",-1,-1,MATCH
"applebee's introduces new 50 appetizers for $250 special",1,1,MATCH
"las vegas review-journal taps glenn cook to steer newsroom temporarily after rocky month",-1,-1,MATCH
"don't be surprised by retiree healthcare costs",-1,-1,MATCH
"holy knockoff, batman! man busted for throwing 'batarang' at cops",-1,1,FAIL
"one court, indivisible, votes liberty and justice for all",-1,-1,MATCH
"police remove last of dakota access pipeline protesters from camp",-1,1,FAIL
"bats shooed out of nation's waterslide tunnels in preparation for summer",1,1,MATCH
"passport robot tells man of asian descent his eyes are too closed",-1,1,FAIL
"advertising executive gets in touch with inner-child demographic",1,-1,FAIL
"5 key essentials needed for business success",-1,-1,MATCH
"the soul's ingredients: the secret to summoning your soulmate",-1,-1,MATCH
"ne-yo helps to raise $2.3 million for california engineering school",-1,-1,MATCH
"donald trump misspeaks, calls u.s. a company instead of a country",-1,-1,MATCH
"last few republican senators form roman tortoise",1,1,MATCH
"what being 'pro-israel' should mean",-1,-1,MATCH
"my friend michael and the power of acknowledgement",-1,-1,MATCH
"on the menu: 7 questions with chef luigi fineo",-1,-1,MATCH
"touring raffi refuses to play 'shake my sillies out'",1,-1,FAIL
"easy wife gives it up on first date night",1,1,MATCH
"lindsay lohan's rehab stint off to great start─and she's gone",1,1,MATCH
"hillary clinton really wants you to think she's tough on wall street",-1,-1,MATCH
"pigeon's route accommodated",1,-1,FAIL
"this pup who retrieves grocery bags from car is even better than fresh direct",-1,-1,MATCH
"how some of trump's bad tweets are helping puppies and kittens",-1,-1,MATCH
"after astana peace talks, obstacles remain to maintain cease-fire in syria",-1,-1,MATCH
"ikea ceo wants new desk on his desk by end of day",1,1,MATCH
"area man determined to make the best of situation comedy",1,1,MATCH
"republicans urge obama administration to crack down on sanctuary cities",-1,-1,MATCH
"dad suggests arriving at airport 14 hours early",1,1,MATCH
"the major concern with the phone call with taiwan",-1,-1,MATCH
"activist wet-t-shirt judge votes for girlfriend",1,-1,FAIL
"man treats mother to detail about his personal life",1,1,MATCH
"nation gets really tired all of a sudden",1,1,MATCH
"watch justin timberlake literally do the robot in 'filthy' music video",-1,-1,MATCH
"only name area man recognizes on ballot 'jill stein'",1,1,MATCH
"how to safely thaw a turkey",-1,-1,MATCH
"watch rory gilmore geek out with michelle obama in 'gilmore girls' teaser",-1,-1,MATCH
"ryan handed romney's latest political positions before walking on stage",1,-1,FAIL
"red cross accused of wartime non-profiteering",1,1,MATCH
"weary haitians shrug as ragnarök begins outside port-au-prince",1,-1,FAIL
"containing steph curry -- impossible?",-1,-1,MATCH
"goody introduces new line of governess hairbrushes for raking across the scalps of insolent little girls",1,1,MATCH
"nba players #prayforpaulgeorge after horrific injury",-1,-1,MATCH
"i won't be coming home for christmas: the christmas experience in prison",-1,-1,MATCH
"after the march for science, it's time to get political",-1,-1,MATCH
"mom learns about new vegetable",1,1,MATCH
"two dead after shooting at oklahoma city airport",-1,-1,MATCH
"golden retriever mauls 5 in huge victory for pitbull apologists",1,-1,FAIL
"landmarks turn blue for world autism awareness day",-1,-1,MATCH
"trump holds third real press conference",-1,-1,MATCH
"jenna fischer reveals what pam told michael during his 'office' goodbye episode",-1,-1,MATCH
"these folks had a terrible, horrible, no good, very bad time tapping this keg",-1,-1,MATCH
"bangladesh bloggers fear deadly backlash won't end soon",-1,-1,MATCH
"mexico city stages james bond-inspired day of the dead parade",-1,-1,MATCH
"chris christie suggests hillary clinton was to blame for boko haram's kidnapping of hundreds of schoolgirls",-1,-1,MATCH
"report: some russian soldiers quit army over ukraine war",-1,1,FAIL
"new bill would limit abortion to cases where procedure necessary to save promising political career",1,1,MATCH
"everything you need to know about food and happiness",-1,-1,MATCH
"monica says lady gaga is right about the 'male-dominated' music industry",-1,-1,MATCH
"bradley cooper racks up staggering one oscar nominations",1,1,MATCH
"let's not forget that men have impeccable winter style, too",-1,1,FAIL
"villain contends he, hero 'very much alike'",1,1,MATCH
"queen elizabeth ii's christmas message: 'light shines in the darkness'",-1,-1,MATCH
"empire state building reopens spire to visitors",1,-1,FAIL
"mom just wants to watch something nice",1,1,MATCH
"office cheering on employee going for 32-minute nonstop work streak",1,1,MATCH
"how marvel beat dc at the movies",-1,-1,MATCH
"no, gay marriage wasn't a conservative win",-1,-1,MATCH
"'boo 2! a madea halloween' leads a sluggish weekend at the box office",-1,-1,MATCH
"steve vai impresses the hell out of neighborhood kids",1,-1,FAIL
"john goodman's mouth obviously full during dunkin' donuts voice-over",1,1,MATCH
"stephen hawking's disability wasn't something to 'overcome'",-1,1,FAIL
"mark zuckerberg promises that misuse of facebook user data will happen again and again",1,-1,FAIL
"the 2018 winter olympics in pyeongchang, by the numbers",-1,-1,MATCH
"man proud of food he ordered",1,1,MATCH
"'look, just tell us who to kill,' snaps u.s. general as trump enters 20th minute of rambling answer on syria",1,-1,FAIL
"curvy model who's had a 'roller coaster relationship' with her belly rolls now embraces them in the punniest way",-1,-1,MATCH
"arsenio hall tapped to host 'bet honors'",-1,-1,MATCH
"obama, biden endorse kamala harris in california senate race",-1,-1,MATCH
"tucker carlson's bizarre rant over lauren duca",-1,-1,MATCH
"senate appropriations has no funding for betsy devos' private school voucher hopes",-1,-1,MATCH
"former tennessee judge allegedly voided traffic fines in exchange for sex",-1,-1,MATCH
"pfizer breaks psychological need to always seek fda's approval",1,-1,FAIL
"leaping kangaroo smashes into unsuspecting cyclist in australia",-1,1,FAIL
"alex jones pleads with sandy hook parents to imagine pain an expensive lawsuit would cause him",1,-1,FAIL
"supportive parents encourage child's interests in anything within 15-minute drive",1,-1,FAIL
"jeb poverty plan would end food stamps, let states sort things out",-1,-1,MATCH
"'wheel of fortune' contestants hit hard as vowel prices skyrocket",1,1,MATCH
"bush spends day feverishly booby-trapping desk",1,1,MATCH
"facebook recognizes everyone needs paid time off. not just parents.",-1,1,FAIL
"men of snl mansplained the 'day without a woman' in spot-on skit",-1,-1,MATCH
"top obama official: this is no iraq war",-1,-1,MATCH
"louis c.k. sends out epic email annihilating donald trump's candidacy",-1,-1,MATCH
"nra starts up their shit about what would be even greater injustice",1,-1,FAIL
"men break down watching footage of female genital mutilation, vow to speak out against practice",-1,1,FAIL
"sleeping man flanked by laptop, phone, earbuds like egyptian pharaoh buried with all his treasures",1,1,MATCH
"sen. richard burr: the cloak and dagger senator",-1,-1,MATCH
"christmas letter ominously makes no mention of the twins",1,-1,FAIL
"ariel castro failed by system",1,1,MATCH
"why i couldn't let breastfeeding go",-1,-1,MATCH
"cloned cheney lacks charm of original",1,1,MATCH
"iranian team openly working on bomb in negotiating room",1,-1,FAIL
"obama suddenly panicked after gazing too far into future",1,1,MATCH
"finally, a virtual reality headset that's cheap and actually works",-1,-1,MATCH
"democrats are using social security as a weapon -- against other democrats",-1,-1,MATCH
"hillary clinton will be nominated because more democrats are voting for her",-1,-1,MATCH
"midwestern tornado destroys 4 world's largest objects",1,-1,FAIL
"report: more americans relying on grandparents to help fuck up their kids",1,1,MATCH
"dolby theatre hunchback stares longingly at beautiful guests from rafters",1,-1,FAIL
"new york times seeks court order to remove tuesdays with morrie from bestseller list",1,-1,FAIL
"women in business: catherine courage, senior vice president, customer experience, citrix",-1,-1,MATCH
"a look at transgender sex workers living in china",-1,-1,MATCH
"why writers must plan to be surprised",-1,-1,MATCH
"california shooter killed wife the night before attacking elementary school",-1,-1,MATCH
"homosexual tearfully admits to being governor of new jersey",1,1,MATCH
"selig counted money while baseball lost the next generation of fans",-1,-1,MATCH
"jeopardy! viewer had no idea he knew so much about weasels",1,1,MATCH
"ken burns implores stanford graduates to believe sexual assault survivors",-1,-1,MATCH
"these influential marijuana users defy the stoner stereotype",-1,-1,MATCH
"syrian army helicopter crashes; crew captured by rebels",-1,1,FAIL
"will the empire strike back? hopes and fears in the gop establishment.",-1,-1,MATCH
"yahoo's meeting programmatic demand from advertisers at the newfront (video)",-1,-1,MATCH
"jake hyland of kansas city, mo chosen as nation's designated survivor in case rest of country wiped out during presidential address",1,1,MATCH
"ceiling fan's one burning ambition to come loose and murder everyone in denny's",1,-1,FAIL
"study finds controlled washington, d.c. wildfires crucial for restoring healthy political environment",1,1,MATCH
"mitch mcconnell marvels at the judicial crisis he created",-1,-1,MATCH
"the 'love actually' mini-sequel won't include alan rickman or emma thompson",-1,-1,MATCH
"3 networking tips for your summer weekends",-1,-1,MATCH
"sea lion yanks man off boat in effort to snatch fish",-1,1,FAIL
"area man totally blows his chance to see 'exodus: gods and kings' in theaters",1,1,MATCH
"cbs news chief on bob schieffer's return: 'how could you sit out a year like this?'",-1,-1,MATCH
"zachary quinto uses fake name at starbucks. customer gets steamed.",-1,-1,MATCH
"coroner to investigate police killing of rock thrower",-1,-1,MATCH
"drought costs californians an extra $2 billion in electricity expenses",-1,-1,MATCH
"man paid more than enough to put up with this shit",1,1,MATCH
"georgia to provide planned parenthood with free std test kits again",-1,1,FAIL
"9 brands with sexy spokesmodels over 50",-1,-1,MATCH
"hair dyed back to original color",1,1,MATCH
"norad takes area vagina to femstat 3",1,1,MATCH
"bush fishing for compliments during press conference",1,1,MATCH
"white house defends jeff sessions leading fbi director search, despite recusal promise",-1,-1,MATCH
"6 things you didn't know about michael b. jordan",-1,-1,MATCH
"bill to regulate e-cigarettes clears california legislative hurdle",-1,-1,MATCH
"the average nfl career lasts just 3 years. this player is focused on what happens next.",-1,-1,MATCH
"the atheist and the nun",-1,-1,MATCH
"the public service loan forgiveness program is what's best about america",-1,-1,MATCH
"commence to move forward",-1,-1,MATCH
