"russian skater alina zagitova breaks world record set minutes earlier by teammate",0
"a murder in kurdistan",0
"after peddling islamophobia, trump to give speech on islam while in saudi arabia",0
"jill biden prefers the title 'captain of the vice squad' to second lady",0
"teen found in suitcase died from overdose, coroner says",0
"ally sheedy knows you still think of her as an '80s basket case",0
"wedding dj assures anxious man he hasn't forgotten 'build me up buttercup' request",2
"i was, but now i am",0
"samantha bee rounds up comedians for the ultimate roast of donald trump",0
"americans don't really care about trump's 'great wall' ─ but his base sure does",0
"more national dog day celebrity tweets!",0
"report: male hair loss 7 times more painful than childbirth",2
"trump excels at business, but he has no business in international politics",0
"a feminist meets fidel castro",0
"what's your story?",0
"new robert altman film released straight to special-edition director's-cut dvd",2
"oregon man who beheaded mom's cat learns his fate",0
"congress debates coolness of rush",2
"man tries to set a fire aboard plane in china",0
"the first 'rogue one' trailer is a 'star wars' nerd's dream",0
"furious meghan markle can't believe harry hasn't told family she's black yet",2
"noose found in african-american history museum exhibit in d.c.",0
"i'm not an empty nester. i'm just sharing my daughter with the world.",0
"save the date: i am now able to marry justin timberlake",0
"man keeping running total of how many people in gym in worse shape than him",2
"caitlyn jenner on bathing suits: 'don't know if i'm ready to expose myself'",0
"texas to execute death row inmates with new 3-drug molotov cocktail",2
"google launches 'the google' for older adults",2
"years of networking, glad-handing sabotaged by coworker's good idea",2
"man swells with shame after entering zip code into girl scout cookie locator",2
"house of representatives magically switches bodies with senate",2
"alaskan gray wolf can't believe no one told him he's got snow on nose",2
"ray lahood resigns following mysterious disappearance of country road",2
"u.s-backed syrian rebels' pleas for help likely to go unanswered",0
"london police arrest six after synagogue attack",0
"area man will be judge of whether woman actually true baseball fan",2
"bernie sanders stresses 'common good' in vatican attack on capitalism",0
"one of trump's accusers is bringing a train car full of people to the women's march",0
"a talk with fabio viviani",0
"invite your customer into the boardroom",0
"twelve more pie-fucking movies in the works",2
"trump's army secretary pick is victim of 'gay gestapo,' right wing activists claim",0
"area teen receives $2 from grandma",2
"sellout crowd greets sellout band",2
"these are the top 15 u.s. cities for couples, according to rent.com",0
"australian asylum seekers told to choose life in jail or risk death in home countries",0
"this 'homoji'  keyboard brings queer shorthand to your text messages",0
"'mass mobs' are taking over detroit's catholic churches",0
"margaret thatcher's ashes scattered over free market",2
"russian jets in 'unsafe' encounters with destroyer: u.s. official",0
"kim jong-un comes out in support of gay marriage: 'i'm not a monster'",2
"ellie goulding perfectly sums up the sheer terror of panic attacks",0
"kids and high sugar die-ts",0
"new, improved obamacare program released on 35 floppy disks",2
"anne hathaway to moms: 'there is no shame in gaining weight during pregnancy'",0
"joan moran: how to give yourself the gift of time",0
"mick mulvaney, supporter of 2013 government shutdown, blames obama for that one",0
"six ways to support opposition in turkey",0
"here is the 8th person who was at donald trump jr.'s meeting with russians",0
"cocktail-party guest cornered by joel stein",2
"word origin comics: the abc's of education",0
"christian lgbtq group raises money to help pay for gender-affirming surgeries",0
"warren buffett gives single largest charitable contribution",0
"a record number of people have drowned trying to reach europe this year",0
"of course sean spicer's goodbye email contained a typo",0
"troy aikman: i 'knock on wood' hoping i stay healthy after concussions",0
"jay z hopes kalief browder's story will 'save a lot of lives'",0
"trump hints at obamacare replacement that would look nothing like what republicans have in mind",0
"these religions were born in the u.s.a.",0
"this swimsuit model stuns from the neck up, for a refreshing change",0
"the unforgettable memorial of warhol superstar holly woodlawn",0
"the power of expectation",0
"federal judges can't clear someone's record, even for minor, nonviolent offenses",0
"white house probes kushner business loans after ethics questions",0
"new clinton memoir: 'we all made mistakes but you made most of them'",2
"oatmeal breakfast bars packed with protein",0
"budget cheat day lets government splurge on anything it wants once a week",2
"blake lively explains the touching reason she joined the women's march",0
"why is it so darn hard for women to lose that baby weight?",0
"gop lawmaker matt gaetz slams haiti: 'sheet metal and garbage' everywhere you look",0
"blissful ignorance commemorated on annual 9/10 anniversary",2
"microsoft unveils next best thing to teleportation",0
"lesbian ex-mayor has perfect response to ann coulter's hurricane nonsense",0
"harry belafonte is really concerned about trump supporters",0
"anderson cooper briefly speechless when gop strategist swears he's never heard trump lie",0
"clinton reminds new yorkers she moved there hoping career dreams would work out too",2
"uzo aduba's emmys dress is a work of art",0
"exxonmobil swears it's going to start taxes early this year",2
"exclusive video: sean hayes discovers family's criminal past",0
"navy discontinues use of 'port' and 'starboard'will now refer to left as 'thunk' and right as 'moosh-baroo'",2
"obama debuts annoying catchphrase",2
"how nice of dr. luke to now let kesha perform at the billboard music awards",0
"aclu sues trump administration over voter fraud probe",0
"old refrigerator unable to control when it releases water anymore",2
"buyer of $450 million da vinci painting sort of assumed it would come with frame",2
"magic-markered initials fail to deter breakroom rice-cake thief",2
"my wakeup call from arianna huffington",0
"the fashion world is really trying to make crocs 'it' shoes",0
"rupaul is reinforcing the very thing his show is supposed to rebel against",0
"how prepared are directors for the challenges of the nonprofit culture?",0
"the real march madness: slashing student aid",0
"dental hygienist angered by lack of flossing",2
"how to spot your future ex-husband on the very first date",0
"i refuse to put your teen on a diet",0
"number of songs gop candidates can use down to 4",2
"being moody helps us adapt to change",0
"bertha cáceres: 'my mother's is not the first assassination. i don't want another'",0
"why i'm buying a house without a family to put in it",0
"will this be the china century?",0
"artists announce they've found all the beauty they can in urban decay",2
"michigan residents are pretty unhappy with rick snyder",0
"alpha trick-or-treater established by third house",2
"8 reasons to travel this year",0
"what happened when this writer matched with martin shkreli on tinder",0
"why is a dairy farmer with no intel experience the house intelligence committee chairman?",0
"police seize 250 pounds of marijuana smoker",2
"elizabeth warren calls for investigation of ny fed over secret tapes",0
"senator baucus shows rest of congress where he found the dead body",2
"bank teller's bad spanish skills thwart attempted robbery",0
"america's love affair with jim breuer to start any day now",2
"stop hating trump voters",0
"remembering that may of 1963",0
"shocking 'nashville' cliffhanger might be connie britton's swan song",0
"awkward tension mistaken for sexual tension",2
"code word: is 'arrogant' the new 'uppity'?",0
"randy and erika jackson split after 18 years of marriage",0
"heartbreaking video shows starving polar bear on warming canadian island",0
"4 crazy-good kebab recipes",0
"eric trump poses with carcass of safari guide shot on african hunting trip",2
"rookie told to ease up on crime-scene tape",2
"blue-collar democrats to party: it's still the economy, stupid",0
"seed of world war iii planted in beijing middle-school gym class",2
"seabed search for mh370 could end within a week",0
"'matt shepard is a friend of mine,' and my son",0
"suicide attack at methodist church in pakistan kills nine, wounds dozens",0
"budweiser unveils social anxiety bottle with 900% more label to pick at",2
"here's what 'all my life' singers k-ci & jojo look like now",0
"americans approve of barack obama's legacy but don't necessarily want to see it continue",0
"meg gavin's gps guide for finding perspective",0
"amazon pulls racist 'slavery gets s**t done' products from website",0
"cable-tv judge overruled by network-tv judge",2
"libertarian reluctantly calls fire department",2
"nate berkus and jeremiah brent are married!",0
"sole remaining lung filled with rich, satisfying flavor",2
"florida atheist sets up anti-trump festivus pole at city's christmas display",0
"woman nervous mom starting to use her as confidant",2
"man has pretty good idea which friend going to give up on dream first",2
"khrushchev's granddaughter just compared trump to stalin",0
"name on valentine misspelled",2
"more than 1,300 law professors oppose jeff sessions for ag",0
"ozzy osbourne bites head off five-pound chocolate rabbit",2
"tea party plans to recruit more coloreds this fall",2
"friend of friend better friend than friend",2
"for all the girls i loved before i knew i could",0
"lesser piece of paper used to test pen's viability",2
"bollywood remake of fahrenheit 9/11 criticizes bush administration through show-stopping musical numbers",2
"the 'here comes honey boo boo' scandal: mama june speaks out",0
"extending your social media reach: working the facebook author tag feature",0
"create the ultimate 'boomer cave' from your empty nest",0
"nearly one million affected by flooding in myanmar",0
"chess grandmaster tired of people comparing every life situation to chess match",2
"do trump voters continue to support repeal of obamacare?",0
"airlines to congress: stop norwegian air!",0
"ceo's funeral a networking dream",2
"new gallup poll finds 40% of americans probably going to skip michelle's party",2
"breaking: daniel throwing his life away, you should call him, he dropped out of wharton─wharton, for god's sake",2
"here's more evidence that trump's 'poll truthers' are wrong",0
"more charges on the way in connection with baruch college hazing death",0
"getting off the t train",0
"romney to town hall audience: 'i own horses and care for them, and you are all like horses'",2
"dwarf actor assured guest spot on 'how i met your mother' will not be demeaning",2
"land rights for women mean progress for communities",0
"nationwide art project is making space for historic women in all 50 states",0
"charlottesville suspect might have received tacit support from high-level government figure",2
"the cop in the 'what are those?' meme loves that 'black panther' joke",0
"john stamos finishes rehab, tweets he's 'healthy' and 'grateful'",0
"eerie sci-fi short explores quest to feel 'connected' with a surprising star",0
"entire meal consumed while testing if it needs more time in microwave",2
"shaun king has twitter account suspended after cnn email exchange",0
"18-to-35 white, male demographic still searching for perfect way to quench its thirst",2
"sunday roudup",0
"photographer captures private moments of lgbtq icons in stunning color",0
"jewelry company jumps gun with engagement ring commercial featuring polyamorous triad",2
"cruz hits back at 'cronyist, washington cartel' iowa governor",0
"new anti-drug program teaches teens to resist psychiatrist's constant pressure to use drugs",2
"kristina reveals how she's dealing with dean after 'bachelor in paradise'",0
"sad man tears 2 bananas off larger bunch",2
"what's it like making a terrence malick movie? we asked 'knight of cups' star freida pinto",0
"report: turkey sandwiches an excellent source of turkey sandwiches",2
"frustrated obama writes letter to his congressman about need for gun control",2
"union claims sanders campaign staffers posed as members to influence workers",0
"there isn't a "war on christmas." there's a fight for inclusivity.",0
"wall street doesn't believe elon musk can produce 500,000 cars by 2018",0
"deputies fatally shoot 6-year-old in his home while firing at suspect",0
"open casket really ruining vibe at funeral",2
"george and amal clooney cozy up at casamigos launch party in ibiza",0
"98% of babies manic-depressive",2
"investigation of what fell off nightstand postponed until morning",2
"how trump university relied heavily on the craft of con men",0
"what it's like to date an older man at 17, then marry him",0
"lester holt begins debate by reminding audience these the candidates they chose",2
"meet one of the first cross-service, same-sex military couple to wed",0
"wall street firm develops new high-speed algorithm capable of performing over 10,000 ethical violations per second",2
"white house staff reminded to place lids firmly on trash cans after steve bannon gets into garbage again",2
"'bubble boy' finally comfortable in his own skin",0
"taraji p. henson reacts to first family's thoughts on 'empire'",0
"ellen goes hetero for halloween!",0
"man deeply suspicious after insurer covers prescription without hassle",2
"sarah silverman channels joan rivers in heaven",0
"classic boring",2
"cleveland killing prompts facebook to review handling of violent posts",0
"dolores huerta calls out trump for treating latinos like 'newcomers'",0
"indira gandhi: 30 years later, not a fond memory",0
"mysterious benefactor leaves coupon book to dozens of local establishments in man's mailbox",2
"5 ways to make cocoa more sustainable",0
"10 eating habits linked to dying from cardiovascular disease and diabetes",0
"son's black market value checked online",2
"black people need more representation and fewer 'representatives'",0
"cbs picks up nbc nightly news",2
"study exposes risks of conducting research while driving",2
"'you got it TM' trademarked",2
"this muffuletta dip is the one recipe you need to make this weekend",0
"man rides a horse into taco bell, and the internet is freaking out",0
"emily's list makes its first 2018 house race pick",0
"could gucci's clueless co-opting of queercore inspire new resistance?",0
"sens. mccain, graham: trump's order could become 'self-inflicted wound' in terror fight",0
"hotels with height: the world's ten best treetop stays",0
"thoughtful ocean returns body a few days after borrowing it",2
"area dad botches 'princess bride' quote",2
"amy poehler and ike barinholtz try to play guess who without discriminating",0
"gop moderates plot way out of house budget mess",0
"melissa mathison, oscar-nominated 'e.t.' screenwriter, dead at 65",0
"authorities on loudspeaker plead with holdout characters to evacuate disney world while they still can",2
"dinty moore breaks long silence on terrorism with full-page ad",2
"james corden battles neil patrick harris in aca-mazing broadway riff-off",0
"terrible idea committed to paper",2
"heartless monster walks out of local small business without buying anything",2
"perfect gift for boring asshole found at crate & barrel",2
"new study finds earth's core will be most habitable part of planet by 2060",2
"death of mentally ill woman in police custody ruled a homicide",0
"hate preachers on qatar campus: obama gives qatar undeserved a+ on fighting incitement",0
"after celebrating: the hard work of lgbt equality continues",0
"10 corners you should never cut when planning a wedding",0
"fact or fiction? identifying reliable integrative medicine resources",0
"report: airlines installing uncomfortable bumps in seatbacks because it pleases them",2
"parents officially designate upstairs television for anyone who doesn't want to watch thanksgiving football",2
"report: majority of diner's salt and pepper shakers currently being used to diagram elaborately planned bank heists",2
"these images show what an impeachment looked like 150 years ago",0
"when the detainee is american . . .",0
"u.s. assures hong kong that their protest just one of many issues white house staying silent on",2
"breathe: raising the voice of justice",0
"like, share and, now, shop on facebook",0
"death penalty and redemption: thoughts on tsarnaev and american christianity",0
"dems call for investigation into group behind planned parenthood 'sting' videos",0
"friends trying on each other's glasses revel in glorious mayhem of having slightly different prescriptions",2
"the giant panda is no longer listed as endangered",0
"history is made as rams officially sign michael sam to 4-year multi-million dollar contract",0
"abc cancels acting with the stars",2
"from tacos to pad thai: 12 standout shrimp recipes",0
"nate silver blinded by gods for seeking forbidden knowledge of future",2
"americans give thumbs down to donald trump's debate attacks",0
"tight wisconsin house primary too close to call (update)",0
"kristen wiig is a comedy goddess in this deleted 'snl' sketch",0
"shark attack claims life of some guy on tv",2
"32 gifts people with anxiety really want for the holidays",0
"woman shuts down dude who demanded $5 back for coffee date",0
"long john silver's customer finds deep-fried poseidon head in value meal",2
"josh earnest's first wh briefing didn't end so well",0
"report: peaceful transfer of power makes last-minute push to become most pressing issue of 2016 election",2
"deadline for prior user to remove clothes from dryer extended 5 minutes",2
"dear president trump: breaking up banks isn't so hard to do",0
"apple unveils single colossal iphone all americans can use at once",2
"obama clears 2,000 square miles of u.s. airspace for new free-range drone preserve",2
"mit physicists split the smithereen",2
"ladies, let 1970 cosmo tell you 'things to do with your hands that men like'",0
"cubs fans caught in time loop now that 'next year' is in the past",0
"camera admits it can't do much for barry",2
"we just can't back donald trump, 30 former gop lawmakers say in letter",0
"bankrupt dot-com proud to have briefly changed the way people buy cheese graters",2
"do you really need to succeed?",0
"teen jumps on whale shark like it's nbd",0
"look: what it's like to race canoes in ny's hudson river",0
"nurse barred from jail after allegedly performing exorcism on inmate",0
"breathalyzer big hit at cop party",2
"dunkin' donuts is fueling our almond milk obsession at just the wrong time",0
"area dad looking to get average phone call with adult son down to 47.5 seconds",2
"college student still managing to look like asshole in picture of village he helped build",2
"all of child's fondest memories times when dad trying to make up for things",2
"israeli ban targeting boycott supporters raises alarm abroad",0
"this is how we know daca didn't cause the border crisis",0
"role of tree ineptly played by second-grader",2
"policewoman flashed more than her badge at cop conference: report",0
"why more men should practice yoga",0
"toyota recalls 1993 camry due to fact that owners really should have bought something new by now",2
"malcolm-jamal warner likens cosby scandal to woody allen, roman polanski controversies",0
"congress puts aside partisan differences for good of military contractors",2
"trade war with u.s. would bring 'disaster' to world economy, china warns",0
"everyone in whitey bulger trial found dead in woods outside dorchester",2
"would you buy a 1,433-pound meteorite for $1.1 million?",0
"new study reveals majority of americans want",2
"west virginia mayor, official lose jobs over post calling michelle obama 'ape in heels' (update)",0
"hey, which one of you wise guys teleported me into the future?",0
"the glory days: iv",0
"arkansas executes first inmate in 12 years",0
"father of muslim american war hero: we cannot defeat terror by dividing america",0
"community solar brings renewable energy 'to the masses'",0
"gingrich urges romney to drop out so he can focus on general election",2
"trump's budget would be devastating to poor victims of domestic abuse",0
"lucky charms' new marshmallow piece is the magical unicorn head",0
"salmonella outbreak sickens more people following multi-state egg recall",0
"hopes of religious freedom in former soviet union fall short",0
"teddy bear feels terrible for sparking 'what are we?' conversation",2
"tennis ball brought on trip",2
"supermodel's true beauty comes from outside",2
"fourth-grade teacher receives dark portent of coming storm from gnarled, haggard third-grade teacher",2
"elon musk embarrassed after realizing he proposing idea for thing that already exists",2
"company's employees spend entire day touching base",2
"perverted creep keeps asking women what they're wearing",2
"top doj official implies reporter may not be jailed in leak case",0
"pier 1 issues formal apology for rattan death march",2
"why i decided not to do a phd",0
"the one thing you need for positive change",0
"the most important thing i want my wife to know this mother's day",0
"female former franken staffers say he was a 'champion for women'",0
"new prisoner recognized from 'scared straight' visit",2
"reporters storm san bernardino shooters' home like a pack of vultures",0
"sarah palin defends curt schilling: 'espn continues to screw up'",0
"u.s. consumer confidence shaken after mom buys wrong kind of tortilla chips",2
"france arrests 15-year-old boy over 'imminent paris attack",0
"the price for killing workers must be prison",0
"country singer & former 'one tree hill' star jana kramer welcomes daughter jolie rae",0
"8 ways to really travel better",0
"female authors accuse junot diaz of 'virulent misogyny'",0
"area teens find once-in-a-lifetime love",2
"democrats will insist on 60 votes for trump's high court nominee",0
"mar-a-lago caddy injures shoulder carrying heavy set of classified national security briefings around golf course",2
"couple just wants small ceremony in public park with close friends and shirtless stranger hanging around tree",2
"senate's new plan to repeal but not replace obamacare is dead",0
"roy moore on pedophilia accusers: 'these women are only discrediting me now because shifting sociocultural norms have created an environment in which assault allegations are taken seriously'",2
"romney: 'we should never apologize for american values or japanese internment camps'",2
"egypt sentences 17 people to jail for practicing homosexuality",0
"wife too busy videotaping elk attack to save husband's life",2
"magazine runs article about louis c.k.",2
"biden quietly asks obama to pick him up some of those real throwing stars from japan",2
"gore calls for recount of supreme court vote",2
"a bittersweet goodbye to pregnancy",0
"prince harry, meghan markle debating between hawaiian luau- or 'x-files'-themed wedding",2
"man hoping people notice how many folding chairs he's carrying at once",2
"all-american ticket hails from alaska, panama canal zone",2
"weak-willed coward changes opinion after learning he was wrong",2
"words of wisdom gained from watching the comey hearing",0
"banking reform measure prevents chick-fil-a from calling itself a bank",2
"donald trump responds to doug jones defeating roy moore in alabama senate election",0
"showers with girlfriend increasingly cleansing-focused",2
"football fan disappointed by 'super tuesday'",2
"what about libya: or how the u.s. prioritizes one suffering nation over another",0
"why you should use conditioner before getting in the shower",0
"friend dishonorably discharged from navigation duties after missing exit",2
"swiss avalanche kills thousands; world stays neutral",2
"clown looked a lot different in online profile photo",2
"study: 90% of bike accidents preventable by buying car like a normal person",2
"jian ghomeshi announces new podcast, gets rightfully dragged",0
"nutter butters 'ruined forever' for nutter butter factory worker",2
"huffpollster: hillary clinton leads nationally, struggles in some battleground states",0
"man unknowingly purchases lifetime supply of condoms",2
"tarantino-style 'star trek' trailer shows us the wonderful potential",0
"trump administration proposes massive expansion of offshore drilling",0
"elementary school teacher accused in rape of former student",0
"study: pretending everything's okay works",2
"bank of america introduces new $50 underdraft fee",2
"thousands of pigs rescued in china after photos of flooded barn go viral",0
"ethical hunter throws duck he shot back into sky",2
"breaking: flight attendant currently attempting to pass cup of cranberry juice over your laptop",2
"another goper has compared planned parenthood to nazi germany",0
"pence passing time during trump's speech by mentally baptizing senators",2
"congress passes seriously uncool legislation",2
"walmart quits selling ar-15s and military-style rifles",0
"i'm an 18-year-old boy who wears blue nail polish -- get over it",0
"10th-grade class watches ben-hur for two weeks",2
"hulk hogan donates hair to lucky locks of love recipient",2
"trevor noah says kanye west isn't kendrick lamar because of the kardashians",0
"man hates it when other guys treat his girlfriend with respect",2
"mom recommends previously unheard-of form of transportation son could take to get home",2
"why stakes is too high to bother with white tears",0
