File:,"../Sarcasm/Sarcasm_train_set_4.csv"
"chinese buffet has french fries",1,1,MATCH
"moving forward with change: part 2 in a series to create lasting health change",-1,-1,MATCH
"leslie allen merritt jr., suspect in phoenix freeway shootings, says he is 'wrong guy'",-1,-1,MATCH
"hotshot product talking big game about being good for consumer",1,1,MATCH
"sonoma's wackiest wineries",-1,1,FAIL
"snack scientists develop previously unthinkable capacity to stuff cheese inside itself",1,1,MATCH
"seaworld whales demand 10 percent chum increase",1,-1,FAIL
"brazil's miss bumbum stirs controversy with body art (nsfw)",-1,1,FAIL
"aspiring actor dreams of one day publicly voicing regret for working with woody allen",1,1,MATCH
"los angeles 1992: a personal reflection",-1,-1,MATCH
"10 rules for a great startup idea",-1,-1,MATCH
"the eternal optimist",-1,-1,MATCH
"goodyear unveils new, circular tires",1,1,MATCH
"gop poisoned zika bill to satisfy 'crazies,' says harry reid",-1,-1,MATCH
"all y'all urged to go fuck yo' selves",1,1,MATCH
"hbo presentation fails to deliver promised 'brief nudity'",1,1,MATCH
"bill maher calls out donald trump's racism with spot-on monologue",-1,-1,MATCH
"lives of mitch mcconnell, john boehner, eric cantor retain meaning",1,1,MATCH
"jukebox pretending oasis cd too scratched to play",1,1,MATCH
"salad suppliers pledge to continue including just enough in bag that some will go bad if you're single",1,1,MATCH
"neighbors come together to watch bmw owner struggle in snow",1,1,MATCH
"study finds every style of parenting produces disturbed, miserable adults",1,1,MATCH
"family worried where grandma going with conversation on low-income housing",1,1,MATCH
"leslie jones website hack under investigation by department of homeland security",-1,1,FAIL
"first draft of paper inadvertently becomes final draft",1,1,MATCH
"getting your photography published 2.0",-1,-1,MATCH
"the story of sheldon adelson's purchase of a las vegas paper is even crazier than you think",-1,-1,MATCH
"personnel director really enjoyed meeting you",1,1,MATCH
"the vergara era, part 1: how we got here",-1,-1,MATCH
"taco bell, where a 'lifetime of food' costs just $10,000",-1,-1,MATCH
"dad asks famous people to tweet his bullied son a happy birthday, and they deliver",-1,-1,MATCH
"eccentric man introduces new sweater to closet pals colonel coat and captain blazer",1,1,MATCH
"mister rogers' neighborhood gerrymandered to serve king friday's make-believe agenda",1,1,MATCH
"read the new federal court ruling blocking trump's travel ban",-1,-1,MATCH
"apple names jeff williams new coo",-1,1,FAIL
"'decision 2000' actually made in smoke-filled room in 1997",1,1,MATCH
"woody harrelson spends two hours drawing marijuana leaf on binder",1,1,MATCH
"president trump, don't hurt americans by sabotaging the aca",-1,-1,MATCH
"this 4-year-old adores chris pratt so much, she totes around a cutout of him",-1,1,FAIL
"mom's hilarious story about her morning shows the hectic life of a parent",-1,-1,MATCH
"anna faris was dropping hints about trouble with chris pratt before split",-1,-1,MATCH
"dick masturbates in tickle creek: cops",-1,1,FAIL
"people are freaking out over chris pine's hilariously weird lookalike",-1,-1,MATCH
"'friends' co-creator on whether or not we'll get a reboot",-1,-1,MATCH
"climate change is taking a toll on farmers' mental health",-1,-1,MATCH
"ray charles signs def leppard album",1,1,MATCH
"wheelchair basketball game enjoyed for all the wrong reasons",1,-1,FAIL
"world's largest polluters set to meet by rising sea. will climate come up?",-1,1,FAIL
"census finds enough homeless people living in public library to warrant congressional district",1,1,MATCH
"corrugated-cardboard lobby once again rates all 535 congressmen 'poor' on corrugated-cardboard-related issues",1,1,MATCH
"32-year-old actress dies of old age",1,1,MATCH
"elizabeth warren's pick wins ohio's democratic gubernatorial primary",-1,1,FAIL
"ohio state university attack leaves 11 injured",-1,-1,MATCH
"drug-resistant bacteria often lurk in children's, dogs' sandboxes",-1,1,FAIL
"biden urges paul ryan to check out nude scene from 'porky's' on phone",1,1,MATCH
"4 identity protection habits every college student should have",-1,-1,MATCH
"the democrats' race back to the future",-1,-1,MATCH
"daniel boulud awards scholarship to c-cap alum",-1,1,FAIL
"this congressman thinks we can fix the economy by drinking beer",-1,-1,MATCH
"seth meyers calls out al franken for 'horrifying' groping photo",-1,-1,MATCH
"congressman boehner's terror alert skin set back to orange",1,1,MATCH
"6 summer salads you'll actually crave",-1,1,FAIL
"company to use internet to waste money, employees' time",1,1,MATCH
"every time area man drops by, friend is watching the big lebowski",1,1,MATCH
"study: u.s. wastes 2 million hours annually figuring out where tape roll starts",1,1,MATCH
"5 friendship lessons you learned on the playground",-1,-1,MATCH
"james comey quickly reopens clinton email investigation for few more minutes",1,1,MATCH
"what i learned from being diagnosed with narcolepsy",-1,-1,MATCH
"marine determined to win heart, mind of at least one iraqi",1,1,MATCH
"just area man's luck",1,1,MATCH
"hillary's last name dropped from senate race",1,1,MATCH
"consumer entering that awkward age between target demographics",1,1,MATCH
"want to watch your entire life pass by in an instant? just do this",-1,-1,MATCH
"5 of the most interesting restaurants in the world",-1,-1,MATCH
"cancer researchers develop highly promising new pink consumer item",1,1,MATCH
"gop congressman: getting rich will solve that whole environment thing",-1,-1,MATCH
"let this daft captain convince you to take a boat instead of a plane",-1,-1,MATCH
"donald trump is as rich as he says, if you do the accounting wrong",-1,-1,MATCH
"joe paterno dies in hospital; doctors promise to tell their superiors first thing tomorrow",1,1,MATCH
"procrastinating catholic 20 rosaries behind",1,1,MATCH
"watch a new scene and promo from 'the walking dead' season 6",-1,-1,MATCH
"nuns and advocates protest planned pipeline by erecting a chapel in its path",-1,-1,MATCH
"man only has himself to blame for what's in targeted banner ad",1,1,MATCH
"struggling airline helped by friendly giant",1,1,MATCH
"as officials attempt to protect dams, more houston neighborhoods deal with flooding",-1,-1,MATCH
"like issa rae, i'm also 'rooting for everybody black'",-1,1,FAIL
"this adulting thing is hard",-1,-1,MATCH
"hillary clinton says she's not ready to take a position on marijuana legalization yet",-1,-1,MATCH
"how 'brooklyn' became the year's best book adaptation",-1,-1,MATCH
"he was a friend of mine: jack slater",-1,1,FAIL
"the greatest -- muhammad ali --  dies at 74",-1,-1,MATCH
"shotgun blast to abdomen just pisses wilford brimley off more",1,1,MATCH
"ben carson calls transgender military members a distraction",-1,-1,MATCH
"area man finally finds bodymate",1,1,MATCH
"hasbro pledges additional 30 marbles for hippo-hunger relief",1,1,MATCH
"watch a comedian mow down every stupid gun rights argument you've ever heard",-1,-1,MATCH
"un rebukes trump's jerusalem move in overwhelming vote",-1,-1,MATCH
"trump officially declares opioid crisis an emergency 2 months after saying he would",-1,-1,MATCH
"guy just trying on shirt right in middle of store",1,1,MATCH
"new alternative-fuel suv will deplete world's hydrogen by 2070",1,1,MATCH
"friday's morning email: flynn reportedly wants immunity",-1,-1,MATCH
"ice-t and coco talk sex during pregnancy",-1,-1,MATCH
"former senator to run pot company",-1,-1,MATCH
"bitcoin plunge reveals possible vulnerabilities in crazy imaginary internet money",1,1,MATCH
"darla moore",-1,1,FAIL
"how much beer the world drinks, in 1 interactive globe",-1,-1,MATCH
"the 'mind diet' could protect you from alzheimer's and age-related cognitive decline",-1,-1,MATCH
"demi lovato drops emotional 'nightingale' music vid",-1,1,FAIL
"5 ways to create the perfect outdoor room",-1,-1,MATCH
"woman getting all defensive about inherent worth and selfhood",1,-1,FAIL
"7 reasons why we love patrick stewart, on his 75th birthday",-1,-1,MATCH
"'guardians of the galaxy' hits a milestone at the box office",-1,-1,MATCH
"here's what happened when a drag queen interviewed trump supporters",-1,-1,MATCH
"'stranger things' season 2 trailer is an eleven out of ten",-1,-1,MATCH
"do you have what it takes to be a prison censor?",-1,-1,MATCH
"police say conditions too nippy to rescue missing hiker",1,-1,FAIL
"china slaughters population to control flu outbreak",1,1,MATCH
"these chicago landmarks are open to the public for the first time in decades",-1,-1,MATCH
"anxious gina haspel gives self little pep interrogation in bathroom mirror",1,1,MATCH
"north korea demolishes tunnels at nuclear test site, reports say",-1,-1,MATCH
"how a tv-free summer is changing our family",-1,-1,MATCH
"4 simple ways to stay grounded and stress-free during the holidays",-1,-1,MATCH
"herpetologist names son after famous herpetologist",1,1,MATCH
"nabisco tentatively adds hummus to list of approved ritz toppings",1,1,MATCH
"white sprinter finishes fifth",1,1,MATCH
"why my daughter's nursery will be pink",-1,-1,MATCH
"study: 89% of husbands planning to surprise wife on valentine's day by dressing as naked, chubby cherub",1,1,MATCH
"report: you live in an embarrassing country",1,1,MATCH
"laffy taffy sponsors every cobblestone at 9/11 memorial",1,1,MATCH
"skin in the game: why republicans' ahca bill should fail",-1,-1,MATCH
"democrats could lose up to 8,000 seats in upcoming midterm election",1,-1,FAIL
"toilet-paper edge given classy appearance with triangular fold",1,1,MATCH
"quiet loner really comes out of shell at gun store",1,1,MATCH
"8 life lessons you can learn from bruce springsteen",-1,-1,MATCH
"'time for japan to get more involved in the middle east,' says mp taro kono",-1,-1,MATCH
"the 5 things about clothing you don't need to tell older women",-1,-1,MATCH
"report: more american children raised by carjackers who didn't realize there was someone in backseat",1,1,MATCH
"internal weakness openly shared with coworkers",1,1,MATCH
"mitt romney soars in polls after leaving country",1,1,MATCH
"data technician by day a data technician by night",1,-1,FAIL
"new stapler makes all other staplers look like worthless shit",1,1,MATCH
"tom clancy treated like he's some kind of terrorism expert",1,1,MATCH
"clinton goes on fun plane ride",1,1,MATCH
"bill cosby's admission could aid women's cases, lawyers say",-1,-1,MATCH
"ben carson leading in iowa, new surveys find",-1,1,FAIL
"skipping out on friend's birthday party at last minute closest woman will ever come to feeling rush of heroin",1,1,MATCH
"climate experts say only hope for saving planet lies with people who save napkins from takeout order",1,-1,FAIL
"fda: lucky charms no longer part of complete breakfast",1,1,MATCH
"no one on pirate ship has any idea what 'splicing the mainbrace' means",1,-1,FAIL
"historical archives: to be sold - tri-cornered shoes",1,1,MATCH
"editors of 'good car' magazine: 'the 2013 hyundai sonata is a good car'",1,-1,FAIL
"supreme court understudy fills in for scalia",1,-1,FAIL
"brits slam theresa 'the appeaser' may for refusal to condemn trump's refugee ban",-1,-1,MATCH
"the very best part of an internet-free family vacation",-1,-1,MATCH
"shirtless goofball in flag underwear invades field at world series",-1,-1,MATCH
"mitt romney jots down ideas for concession speech while obama talks",1,1,MATCH
"my high school boyfriend, the con artist",-1,-1,MATCH
"god shoots himself while cleaning gun",1,1,MATCH
"what mount greenwood's reaction to joshua beal's death says about white chicago",-1,-1,MATCH
"once mighty super bowl commercial now sad, pathetic 'price is right' commercial",1,-1,FAIL
"8-month-old sick of staring at pooh's smug face all day",1,1,MATCH
"pearl harbor survivors do the mannequin challenge like seasoned pros",-1,-1,MATCH
"guitar-instruction manual has eddie van halen on cover, 'go tell aunt rhody' inside",1,1,MATCH
"congress splits into male and female senators to discuss newest reproductive bill",1,-1,FAIL
"bathroom smells like shit",1,1,MATCH
"a weighty new year's resolution",-1,-1,MATCH
"ten years later, it's still gut-wrenching to look back at katrina footage",-1,1,FAIL
"thin mints exchange hurried farewells as carol enters breakroom",1,1,MATCH
"new york's finest protect new york's richest",1,1,MATCH
"here's proof 'doing what you love' pays off",-1,-1,MATCH
"father not letting firstborn repeat mistakes he made as nine-month-old",1,1,MATCH
"report: 40 percent of american high-school students mind-reading at sixth-grade level",1,1,MATCH
"report: gap wider than ever between ultra-rich and reality",1,1,MATCH
"rc car works up courage to approach group of girls",1,1,MATCH
"california's brutal drought could change the state forever",-1,-1,MATCH
"inspirational disabled horse crosses preakness finish line after 11 hours",1,1,MATCH
"senate panel unanimously approves chris wray's nomination as fbi director",-1,-1,MATCH
"gop candidates bound to feel 'climate shock' on the  campaign trail",-1,-1,MATCH
"et, access hollywood, tmz choppers hovering above scene of gruesome red carpet dress",1,1,MATCH
"hugh grant marries for the first time at age 57",-1,-1,MATCH
"new law requires sex offenders to inform residents before moving into their homes",1,1,MATCH
"teaching, learning and the college ratings framework",-1,-1,MATCH
"why did wikileaks name 'country x' when glenn greenwald wouldn't?",-1,-1,MATCH
"it only takes five minutes to show how thorny america's gun control is",-1,-1,MATCH
"older brother playing with younger brother on swing set will one day con him out of $50,000",1,1,MATCH
"kim jong-un wonders if nuclear threats distracting him from real goal of starving citizenry",1,1,MATCH
"87% of millennials donated to charity last year and you should stop calling them selfish: report",-1,-1,MATCH
"this supreme court case could significantly weaken teachers unions",-1,-1,MATCH
"fcc chief cites special occasion for allowing vaginal penetration on network sitcom",1,1,MATCH
"faa to ban plane crashes",1,-1,FAIL
"reno orders investigation of u.s. department of corruption",1,1,MATCH
"this university is pledging free tuition to students displaced by harvey",-1,-1,MATCH
"china's potemkin villages",-1,1,FAIL
"south african court more than doubles oscar pistorius sentence",-1,-1,MATCH
"rumsfeld wearing same shirt for fourth straight day",1,-1,FAIL
"eighth-grader hasn't missed a '69' joke opportunity all year",1,-1,FAIL
"tuesday's morning email: trump's bad press just got worse",-1,-1,MATCH
"cop pleads not guilty in killing of sam dubose",-1,1,FAIL
"here's how washington, d.c. can drive innovation in education throughout the country─with no strings attached",-1,-1,MATCH
"writer unwilling to admit his screenplay perfect fit for justin long",1,-1,FAIL
"christina aguilera deeply offended by plate of iceberg lettuce",1,1,MATCH
"mariah carey and nick cannon reunite for the holidays",-1,-1,MATCH
"republican platform falsely says planned parenthood sells baby parts",-1,-1,MATCH
"defensive clinton campaign releases new 'who are you to judge me?' ad",1,1,MATCH
"miss israel's selfie with miss lebanon stirs up controversy",-1,1,FAIL
"tim kaine stuffs handful of goldfish crackers in ballot scanner",1,1,MATCH
"box of old playboys found, good ones too",1,1,MATCH
"kirsten dunst opens up about the life of a child star",-1,-1,MATCH
"dice rolled on hot dogs in back of freezer",1,1,MATCH
"justin bieber has 3 go-to poses and they're all surprisingly amazing",-1,-1,MATCH
"fumbling, inarticulate obituary writer somehow losing debate to christopher hitchens",1,1,MATCH
"authorities urge florida residents to prevent further disasters by finally standing up to hurricane",1,1,MATCH
"thing happens",1,1,MATCH
"las vegas sands pays $9 million to end sec probe into china, macau",-1,1,FAIL
"ariana grande issues 'donut fiasco' apology video that doesn't explain donut-licking",-1,-1,MATCH
"8-year-old allowed to stay up late to watch johnny carson's funeral",1,1,MATCH
"5 reasons trump's mika tweets are even worse than you think",-1,-1,MATCH
"report: excitedly bounding into office remains leading cause of workplace injuries",1,1,MATCH
"seedless watermelon coming to grips with fact it'll never be able to have kids",1,1,MATCH
"freshness escaping from bag of peas",1,1,MATCH
"sudden burst of confidence not sure where the hell it came from either",1,1,MATCH
"the meldonium ban is more about russia's reputation for doping than performance",-1,-1,MATCH
"interview with elaine jung",-1,1,FAIL
"anti-abortion governor ironically tweets about the importance of 'choice'",-1,-1,MATCH
"philippine hitman says he heard duterte order killings",-1,-1,MATCH
"protesters ignored",1,1,MATCH
"new york's attorney general wants to keep birth control free",-1,1,FAIL
"area woman not a morning, afternoon, or night person",1,1,MATCH
"watch: tennis star mirjana lucic-baroni delivers the world's greatest motivational speech",-1,-1,MATCH
"these posts reveal the terrible double standard of how we handle black death",-1,-1,MATCH
"get away, jordan: eulogy for jordan edwards",-1,1,FAIL
"world war iii with china",-1,1,FAIL
"report: 250 million americans still need guests on their podcasts this week",1,1,MATCH
"unemployed sibling makes last push for group mother's day gift",1,1,MATCH
"25 heartwarming holiday proposals that are worthy of a champagne toast",-1,-1,MATCH
"u.s. state department: global terrorist attacks down 13 percent in 2015",-1,-1,MATCH
"three simple steps to not take a bad day home",-1,-1,MATCH
"new study finds human beings were never meant to wake up from sleep",1,1,MATCH
"bigot annoyed local mosque already vandalized before he got there",1,1,MATCH
"child's favorite restaurant also dad's favorite bar",1,1,MATCH
"just a heads up, your eyelashes are probably crawling with mites",-1,-1,MATCH
"it's time to give your sleep environment a makeover",-1,-1,MATCH
"jay-z finally explains how he and beyoncé came up with those baby names",-1,-1,MATCH
"trump retweets video from anti-muslim hate group",1,-1,FAIL
"this is how celebrities spent their summer holidays",-1,-1,MATCH
"aliens arrive late: 'sorry, hope nobody's killed themselves yet,' say aliens",1,-1,FAIL
"nation's dads treated to mark knopfler meet-and-greet",1,1,MATCH
"non-priest arrested on charges of child molestation",1,1,MATCH
"serious mitt romney demanding to be addressed as 'mitthew' now",1,1,MATCH
"madonna's anti-trump cover of britney spears' 'toxic' is the antidote we need to 2016",-1,-1,MATCH
"utah adopts nation's strictest drunk driving law",-1,1,FAIL
"netflix may expand into news",-1,-1,MATCH
"syrian family suffering from meningitis evacuated for treatment",-1,1,FAIL
"man throws money at problem",1,1,MATCH
"real toy used as sex toy",1,1,MATCH
"'the wiz live!' brings the best of black excellence to tv",-1,-1,MATCH
"orlando's number-two animal attraction, behind disney",-1,1,FAIL
"8 awesome (yes, awesome!) things about toddlers",-1,-1,MATCH
"healthy and frosted (!) paleo carrot cake cookies",-1,-1,MATCH
"sean spicer given own press secretary to answer media's questions about his controversial statements",1,-1,FAIL
"an open letter to the republican leadership",-1,-1,MATCH
"ariana grande spills deets on album release on 'tonight show'",-1,1,FAIL
"sports psychologists suggest tiger's slump may be because of all that shit he went through",1,1,MATCH
"5-year-old alabama boy misses fun 'bunker grandpa'",1,1,MATCH
"trump orders strikes on syria in retaliation for chemical attack",-1,-1,MATCH
"hard times and harder choices",-1,-1,MATCH
"al kozlewski pulls a kozlewski",1,-1,FAIL
"polls close in britain's bitterly fought eu referendum",-1,1,FAIL
"photos show aftermath of colombia's deadly floods",-1,-1,MATCH
"pennsylvania supreme court chief scolds his own party for trying to impeach justices",-1,-1,MATCH
"u.s. anachronism at 'all time high,' says truman",1,-1,FAIL
"supporters aggravated bernie sanders didn't use dnc speech to get voters to act against their own self-interest",1,-1,FAIL
"enzyme humbled to have played part in successful biochemical reaction",1,-1,FAIL
"study finds 60% of parents too busy with divorce to worry about football safety",1,1,MATCH
"103 uber drivers accused of sexually assaulting or abusing customers: cnn",-1,1,FAIL
"because every woman wants a man that smells like work boots!",-1,1,FAIL
"travel etiquette: how to use a flight delay to your advantage",-1,-1,MATCH
"sniper draws moustache on crosshairs",1,1,MATCH
"decision to circle parking lot produces carbon emission that finally does it",1,1,MATCH
"sanders beats all top republican candidates in latest poll",-1,1,FAIL
"man basks in triumphant glory after purchases line up to exact value of gift card",1,1,MATCH
"how a man who got his start in construction became the most powerful foreign policy voice in congress",-1,-1,MATCH
"this man used a beyonce concert as a chance to catch up on some reading",-1,1,FAIL
"study: 84% of couples who walk around exploring new neighborhood never make it home",1,1,MATCH
"my picks for gospel winners at the grammys",-1,-1,MATCH
"british model freed after being kidnapped to be sold, italian police say",-1,-1,MATCH
"josh gad would 'jump at the opportunity' for a 'book of mormon' movie",-1,-1,MATCH
"report: fuck guy in kayak",1,1,MATCH
"5 things men can do to strengthen their relationship",-1,-1,MATCH
"cheney suspects bush listening in on other phone",1,1,MATCH
"child at that awkward age where no one cares what he thinks and he's constantly in the way",1,1,MATCH
"out-of-control group yields little usable data",1,1,MATCH
"teacher just hopes they never google him",1,1,MATCH
"some guy at bar lived in san francisco for a summer and liked it a lot",1,1,MATCH
"area man likes food",1,1,MATCH
"prince william may have just hinted at the new royal baby's name",-1,-1,MATCH
"7 sci-fi writers predict the future of the olympics",-1,-1,MATCH
"'i gave up sex as a man in hollywood'",-1,1,FAIL
"divorced man forced to get back down to dating weight",1,1,MATCH
"conspiracy theorist starting to think racism may be institutionalized in america",1,-1,FAIL
"nia long: film and tv should look like the world we live in",-1,-1,MATCH
"in sad, sad press conference, milo says 'free speech week' is now just one measly rally",-1,-1,MATCH
"where's the ref? fifa -- a sports body playing without rules",-1,-1,MATCH
"clinton, hours before 9/11 attack, said he 'could have killed' bin laden",-1,1,FAIL
"domino's introduces thanksgiving feast pizza",1,1,MATCH
"sushi donuts are here, so prepare yourselves",-1,-1,MATCH
"cheney offspring bursts from bush's chest",1,1,MATCH
"chained pen yearns to visit rest of bank",1,1,MATCH
"afghanistan war veteran solemnly recalls seeing entire platoon killed by undiagnosed ptsd",1,1,MATCH
"james corden's double-quick recap of january 2018 is exhausting just to watch",-1,-1,MATCH
"chaplain who said there's 'no such thing as transgenderism' now says obeying constitution serves satan",-1,1,FAIL
"the sales of the week will make you forget that it's 30 degrees in april",-1,-1,MATCH
"houston woman contracts flesh-eating bacterial infection from harvey floodwaters",-1,1,FAIL
"why did corporate reformers overlook newark's children and families?",-1,-1,MATCH
"the walking dead: season 5 finale blasts full afterburners!",-1,-1,MATCH
"faa advises asiana airlines pilot to get back out there after crash",1,1,MATCH
"gentrification mockumentary asks you to please remember rich, white kids",-1,-1,MATCH
"marriage going to be hard to go back to on monday",1,1,MATCH
"the wage gap closed by a whopping one cent in 2015",-1,-1,MATCH
"full unsliced lemon makes glass of water particularly refreshing",1,1,MATCH
"u.s. military lauded for creating gender-neutral killing field",1,1,MATCH
"this senate candidate explains how god-awful and life consuming fundraising is",-1,-1,MATCH
"this year's primary left most voters with a lower opinion of the gop",-1,-1,MATCH
"behold the majesty of the turkey",-1,-1,MATCH
"halliburton employee's pay docked for weeks spent as hostage",1,-1,FAIL
"writer calls on women of color 'to divest from lena dunham' after controversy",-1,-1,MATCH
"the world's worst ebola outbreak, by the numbers",-1,-1,MATCH
"we must increase food aid during time of famine",-1,1,FAIL
"the call to 'restore' for this and every july 4: frederick douglass echoes through the ages",-1,-1,MATCH
"income inequality emerges as key topic to avoid in 2014 elections",1,1,MATCH
"alcohol only thing making operating heavy machinery bearable",1,1,MATCH
"public assured escaped convict has 24 years of rehabilitation under his belt",1,-1,FAIL
"oxiclean unveils new stain-removing fabric scissors",1,1,MATCH
"frustrated man can't believe he can still hear construction worker hammering his wife at this hour",1,1,MATCH
"this is not how you play frisbee, but we love it anyway",-1,-1,MATCH
"tesla debuts carless driver",1,1,MATCH
"the resurrection according to scifi, part 3: harry potter",-1,-1,MATCH
"san andreas fault feels terrible for what it's about to do",1,-1,FAIL
"new sealy mattress recreates feeling of falling asleep on bus",1,1,MATCH
"'family' groups praise president trump's decision to roll back trans rights",-1,-1,MATCH
"rep. david cicilline: lgbt people are entitled to 'full equality'",-1,-1,MATCH
"detroit horror rap group twiztid lets their universe shine through the darkness",-1,-1,MATCH
"bacon just one of sprint's new downloadable ring scents",1,1,MATCH
"the gop's mexico derangement",-1,-1,MATCH
"suicide hotline operator talking to ex-boyfriend again",1,1,MATCH
