File:,"../Sarcasm/Sarcasm_train_set_4.csv"
"how to navigate high school as an out transgender student",-1,-1,MATCH
"police: man killed by officers was holding phone, not gun",-1,1,FAIL
"pbs pulling out the fucking big guns tonight with 'andrea bocelli: one night in central park'",1,-1,FAIL
"fox producers attempt to tire out aggressive candidates before debate by letting them run around outside",1,1,MATCH
"mercy hospital turns away uninsured patient",1,1,MATCH
"director's commentary for one night at mccool's trails off after 20 minutes",1,1,MATCH
"passengers terrified when engine cover rips off plane bound for hawaii",-1,1,FAIL
"women in business q&a: roxane divol, svp and gm, trust services, symantec",-1,-1,MATCH
"area man thinking about getting one of those all-body scans",1,1,MATCH
"g.w. bush: 'not your government's choice' if you worship or not",-1,-1,MATCH
"redstate names leon wolf managing editor as erick erickson prepares exit",-1,1,FAIL
"michelle obama powers through another day of doing half-assed jumping jacks in middle school gym",1,1,MATCH
"that flaming lips origin story is faker than you thought",-1,-1,MATCH
"the salaam games: coming to a stadium near you!",-1,-1,MATCH
"cheap airfare sole reason for trip to italy",1,1,MATCH
"there's a reason powerful americans love to attack black sports figures",-1,-1,MATCH
"trump is telling 'jokes,' but nobody's laughing",-1,-1,MATCH
"u.s. worried about living up to netanyahu campaign promises",1,1,MATCH
"nurses ignore hospital regulations to grant dying man his final wish",-1,1,FAIL
"10 ways to deal with a difficult coworker",-1,-1,MATCH
"small change in procedure wendy's manager's crowning achievement",1,1,MATCH
"target 'dorm room essentials' aisle being browsed exclusively by 30-year-old men with studio apartments",1,1,MATCH
"australian parliament gathers to discuss dwindling hemsworth reserves",1,1,MATCH
"pumpkin clearly had finger in it",1,1,MATCH
"gated community interviews dozens for exclusive drug dealer position",1,1,MATCH
"ex-con back behind bar",1,1,MATCH
"public higher education in america is facing an existential emergency",-1,-1,MATCH
"'queer eye' emotionally reflects on the unique challenges black gay men face",-1,-1,MATCH
"melania trump hangs decayed badger carcass over white house mantel to finish off traditional slovenian christmas decor",1,-1,FAIL
"obama administration takes deportation relief for millions to supreme court",-1,-1,MATCH
"kim jong un reopens long-closed border hotline with south korea",-1,-1,MATCH
"car salesman three desks over going on and on about chick he banged last night",1,1,MATCH
"'gone with the wind' actress says turning 100 is her best role",-1,-1,MATCH
"this parody perfectly explains how lovely it was to be a woman in 2016",-1,-1,MATCH
"fbi director wishes he had some alien thing to cover up",1,1,MATCH
"camila cabello's cover of 'say you won't let go' is raw power",-1,-1,MATCH
"protecting our children when contending with threats of violence",-1,-1,MATCH
"radical islamist preacher anjem choudary found guilty of supporting isis",-1,1,FAIL
"most hillary clinton voters think the allegations against bill clinton are credible",-1,-1,MATCH
"'we're in this together, you guys,' reports newest member of crunch gym",1,-1,FAIL
"for the first time, chimpanzees are making a fashion statement",-1,-1,MATCH
"books with badass female protagonists: what's your go to book?",-1,-1,MATCH
"please god, not robin williams...",-1,1,FAIL
"japan spotted hovering over algeria",1,-1,FAIL
"lynda heffernan's gps guide for self-compassion",-1,1,FAIL
"msnbc host: trump's rallies aren't fun, they're fascist",-1,-1,MATCH
"silvio berlusconi gets penis stuck in wine bottle stuck in prostitute",1,1,MATCH
"the final indian war in america about to begin",-1,-1,MATCH
"suspect in kim jong nam's murder also sickened by toxic nerve agent, police say",-1,-1,MATCH
"we're so excited about this 'saved by the bell' pop-up restaurant",-1,-1,MATCH
"this awesome dad crafts intricate toast breakfasts for daughter with allergies",-1,-1,MATCH
"smoke rings delighting newborn",1,1,MATCH
"drought bad",1,1,MATCH
"morbidly curious nation wondering how far obama's appearance will deteriorate in 2 years",1,-1,FAIL
"jamie foxx does a really good doc rivers impersonation",-1,-1,MATCH
"the 1-800 cases come to philly",-1,-1,MATCH
"the indignant and audacious teacher",-1,-1,MATCH
"if your doctor won't give you an iud because you haven't had kids, you need a new doctor",-1,-1,MATCH
"mom's bathing suit just one giant, body-eclipsing ruffle",1,1,MATCH
"kim jong-un's absence leaves north korean government officials no one to agree with",1,-1,FAIL
"trump's controversial pick for doj civil rights chief appears headed for confirmation",-1,-1,MATCH
"high school principal can already tell students are going to eat this one alive",1,-1,FAIL
"mcdonald's says its packaging will be 100 percent green by 2025",-1,-1,MATCH
"majority of office's supplies used to apply for different job",1,1,MATCH
"'i'm tired of being taxed for being a woman'",-1,-1,MATCH
"this bracelet lets a dad feel what it's like to be pregnant ... in his wrist",-1,-1,MATCH
"what happened to my son's memory?",-1,-1,MATCH
"world's dumbest shoplifters literally run into the police at costco",-1,-1,MATCH
"6 queer couples share their definition of black love",-1,-1,MATCH
"study links drinking while pregnant to being at kid rock concert",1,1,MATCH
"report: getting parents off back now accounts for 38% of economic growth",1,1,MATCH
"trump voters had a much better 2017 than clinton voters did",-1,-1,MATCH
"does the internet really make bullying worse?",-1,-1,MATCH
"rich thrill-seeker takes the bus",1,-1,FAIL
"goddamn ficus plant should come with instructions",1,-1,FAIL
"permission and prohibition",-1,-1,MATCH
"obama is like that really great neighbor who's moving out",-1,-1,MATCH
"growing up in scouting's closet",-1,1,FAIL
"dermatologists recommend regularly checking body for screaming demonic face bulging out of skin",1,1,MATCH
"eco-friendly junkies launch needle re-use program",1,1,MATCH
"why trumpcare is giving senate republicans heartburn",-1,-1,MATCH
"homosexual dolphin has highly developed sense of gay-nar",1,1,MATCH
"twitter users roast fbi over its ms paint-style holiday tweet",-1,-1,MATCH
"mike pence asks waiter to remove mrs. butterworth from table until wife arrives",1,1,MATCH
"school got complaints about teacher even before huffpost revealed her racial bias",-1,-1,MATCH
"philippine congress agrees to extend mindanao martial law to end of year",-1,1,FAIL
"strength to power",-1,1,FAIL
"dozens dead after suicide bomber blows himself up near kabul shrine",-1,1,FAIL
"a woman as indiana jones? yes, please.",-1,-1,MATCH
"kentucky clerk: it's 'impossible' for me to marry gay couples",-1,-1,MATCH
"circus runaway not looking forward to hometown show",1,1,MATCH
"man feeling pressure to live up to conversation between barber and customer in next chair",1,1,MATCH
"taylor swift now dating suri cruise",1,1,MATCH
"new gop governor's inauguration raises questions of corporate influence",-1,-1,MATCH
"nick offerman rsvps to wedding in very ron swanson-esque way",-1,1,FAIL
"housekeeper too busy to be sassy",1,1,MATCH
"parents' password a grotesque combination of children's names, birthdays",1,-1,FAIL
"greenspan to play 15 unannounced small-club shows",1,1,MATCH
"use twitter like a pro with these simple keyboard shortcuts",-1,-1,MATCH
"donna brazile says hillary rodham clinton high palace of the solar order was almost like a cult",1,-1,FAIL
"boyfriend not to be trusted with netflix queue",1,1,MATCH
"17 sweet water toys and swim essentials",-1,-1,MATCH
"grab them by the... hand: donald trump's disturbing nonverbal behavior",-1,-1,MATCH
"how is natural wine different from the stuff you're drinking?",-1,-1,MATCH
"miracle paycheck lasts for 7 whole days",1,-1,FAIL
"police report: sexual assault numbers under control, unless you count the super brutal ones",1,-1,FAIL
"an eye-opening look at school playgrounds around the world",-1,-1,MATCH
"u.s. intel officials knew last year about cia security breach that led to wikileaks dump",-1,-1,MATCH
"obama up early cooking breakfast in one of michelle's extra long t-shirts",1,1,MATCH
"successful u.s. airstrike kills 30 iraqis who may as well have been terrorists",1,-1,FAIL
"it's a girl for christina aguilera!",-1,-1,MATCH
"trump's trade rhetoric is unhinged. his tariffs aren't.",-1,-1,MATCH
"top soccer official says trump presidency would hurt u.s. world cup bid",-1,-1,MATCH
"cracks emerge in rodrigo duterte's horrific philippine drug war",-1,1,FAIL
"taraji p. henson announces memoir 'around the way girl'",-1,-1,MATCH
"drake throws money and angrily storms into club",-1,-1,MATCH
"death row inmate can't deny he curious to see how state pulls off lethal injection",1,1,MATCH
"to drain the swamp" - dilute the money flood"",-1,-1,MATCH
"you might be using these popular words all wrong",-1,-1,MATCH
"california mayor sleeps in cardboard box for night to 'experience' homelessness",-1,-1,MATCH
"kofi annan places 4,000-pound wreath on mass grave",1,1,MATCH
"trump undercuts easy obamacare attack with dig about bill clinton's infidelities",-1,-1,MATCH
"now it's burger king renouncing us citizenship -- let's eat somewhere else",-1,-1,MATCH
"graphic street art of trump shooting schoolchildren sparks outcry",-1,-1,MATCH
"women in business: mollie spilman, chief revenue officer, criteo",-1,-1,MATCH
"yankees affiliate: timing of blue lives matter day an 'unfortunate coincidence'",-1,-1,MATCH
"right next door: matthew mcgorry, actor",-1,1,FAIL
"male substitute teacher with ponytail cloaked in mystery",1,1,MATCH
"larry kramer's the normal heart bleeds for all of us (well, not quite all)",-1,-1,MATCH
"watch: snow drifts were no match for this determined freight train",-1,-1,MATCH
"man somehow overcomes alcoholism without jesus",1,1,MATCH
"la metro's next ceo",-1,1,FAIL
"kfc responds to stockpiling trend with 576-piece bucket",1,1,MATCH
"bernie sanders slams trump: 'that kind of crap is not going to work in the united states'",-1,-1,MATCH
"what makes bill gates feel 'stupid'",-1,-1,MATCH
"telling our medicine story",-1,-1,MATCH
"national review writer: ben carson 'more authentically black' than obama",-1,1,FAIL
"report: 50% of heaven's population just assholes who begged for forgiveness at last second",1,1,MATCH
"trump campaign training poll watchers to spot any suspicious skin colors on election day",1,1,MATCH
"women may be more anxious than men at work because they have more to lose",-1,-1,MATCH
"tuesday's morning email: inside the gop health care and immigration order overhauls",-1,-1,MATCH
"humiliated man discovers embroidery on his jean pockets",1,1,MATCH
"jobless after 50? here's what to do first.",-1,-1,MATCH
"not forgotten: the health and rights of rohingya women and girls",-1,-1,MATCH
"the gop's stockholm syndrome",-1,-1,MATCH
"police: man fatally shoots self while demonstrating how to clean gun",-1,1,FAIL
"geniuses made a must-watch 'formation' parody about anti-abortion laws",-1,-1,MATCH
"cinemax director wins award for skinematography",1,1,MATCH
"a new lena dunham show is coming to hbo",-1,-1,MATCH
"indianapolis sports reporter pours his little heart out in peyton manning retirement column",1,1,MATCH
"alex morgan talks world cup, wedding planning, and yoga on the road",-1,-1,MATCH
"'don't be mad at me for being a picky eater'",-1,-1,MATCH
"don't believe the derrick rose hype",-1,-1,MATCH
"britney spears loses custody of child to in touch magazine",1,1,MATCH
"target demographic growing up right before wistful advertiser's eyes",1,1,MATCH
"surprise international visit makes for heartwarming first meeting between grandson and grandparents",-1,-1,MATCH
"tea party pacs' promise to spend on electing candidates falls flat",-1,1,FAIL
"redford to re-digitize ordinary people, improve space battle",1,1,MATCH
"alabama marriage equality tantrum is a slap in the face to all americans",-1,-1,MATCH
"radio shack salesman 'a little out of it today'",1,1,MATCH
"snl audience moved to tears by soulful, end-of-episode piano music",1,1,MATCH
"tearful mitt romney announces he has rare disease where you can't sit quietly on stool when repeatedly asked to",1,1,MATCH
"ted danson tries to steer interview back toward becker",1,1,MATCH
"climate change may melt the glaciers from glacier national park",-1,-1,MATCH
"6 older celebs who stole the show at the golden globes",-1,-1,MATCH
"donald trump opponents' path to victory is dark and full of terrors",-1,-1,MATCH
"mount vernon says it owns george washington's copy of don quixote, not glenn beck",-1,1,FAIL
"peter dinklage meets the world's worst 'game of thrones' fan in 'saturday night live' promo",-1,-1,MATCH
"clinton makes pact with savages",1,1,MATCH
"lena dunham defends 'girls' writer accused of raping 17-year-old",-1,1,FAIL
"powerful post reminds parents to enjoy the noise while they can",-1,-1,MATCH
"is osha protecting at-risk workers under a trump administration?",-1,-1,MATCH
"twitter unloads on the house gop with #gopsongsaboutethics",-1,-1,MATCH
"spain's state prosecutor calls for charges against catalan leaders",-1,-1,MATCH
"kelsea ballerini believes it's a new era for women in country music",-1,-1,MATCH
"edtech investment is at record levels -- where is all the money going?",-1,-1,MATCH
"abc announces ellen will come out in every episode",1,1,MATCH
"wayne lapierre goes on harpooning spree to prove some sort of point",1,1,MATCH
"forgiveness for mother and child",-1,-1,MATCH
"liberals horrified by lack of inexperience among obama appointees",1,1,MATCH
"naval chakra tune up: yoga sequence from stephanie snyder",-1,1,FAIL
"dress code cracked",1,1,MATCH
"14-year-old collapses under weight of corporate logos",1,1,MATCH
"why trans musician laura jane grace refuses to cancel her nc show",-1,-1,MATCH
"russian skater alina zagitova breaks world record set minutes earlier by teammate",-1,1,FAIL
"a murder in kurdistan",-1,-1,MATCH
"after peddling islamophobia, trump to give speech on islam while in saudi arabia",-1,-1,MATCH
"jill biden prefers the title 'captain of the vice squad' to second lady",-1,-1,MATCH
"teen found in suitcase died from overdose, coroner says",-1,-1,MATCH
"ally sheedy knows you still think of her as an '80s basket case",-1,-1,MATCH
"wedding dj assures anxious man he hasn't forgotten 'build me up buttercup' request",1,1,MATCH
"i was, but now i am",-1,-1,MATCH
"samantha bee rounds up comedians for the ultimate roast of donald trump",-1,-1,MATCH
"americans don't really care about trump's 'great wall' ─ but his base sure does",-1,-1,MATCH
"more national dog day celebrity tweets!",-1,1,FAIL
"report: male hair loss 7 times more painful than childbirth",1,1,MATCH
"trump excels at business, but he has no business in international politics",-1,-1,MATCH
"a feminist meets fidel castro",-1,-1,MATCH
"what's your story?",-1,-1,MATCH
"new robert altman film released straight to special-edition director's-cut dvd",1,1,MATCH
"oregon man who beheaded mom's cat learns his fate",-1,1,FAIL
"congress debates coolness of rush",1,1,MATCH
"man tries to set a fire aboard plane in china",-1,-1,MATCH
"the first 'rogue one' trailer is a 'star wars' nerd's dream",-1,-1,MATCH
"furious meghan markle can't believe harry hasn't told family she's black yet",1,1,MATCH
"noose found in african-american history museum exhibit in d.c.",-1,-1,MATCH
"i'm not an empty nester. i'm just sharing my daughter with the world.",-1,-1,MATCH
"save the date: i am now able to marry justin timberlake",-1,-1,MATCH
"man keeping running total of how many people in gym in worse shape than him",1,1,MATCH
"caitlyn jenner on bathing suits: 'don't know if i'm ready to expose myself'",-1,1,FAIL
"texas to execute death row inmates with new 3-drug molotov cocktail",1,1,MATCH
"google launches 'the google' for older adults",1,-1,FAIL
"years of networking, glad-handing sabotaged by coworker's good idea",1,1,MATCH
"man swells with shame after entering zip code into girl scout cookie locator",1,1,MATCH
"house of representatives magically switches bodies with senate",1,1,MATCH
"alaskan gray wolf can't believe no one told him he's got snow on nose",1,1,MATCH
"ray lahood resigns following mysterious disappearance of country road",1,1,MATCH
"u.s-backed syrian rebels' pleas for help likely to go unanswered",-1,-1,MATCH
"london police arrest six after synagogue attack",-1,-1,MATCH
"area man will be judge of whether woman actually true baseball fan",1,1,MATCH
"bernie sanders stresses 'common good' in vatican attack on capitalism",-1,-1,MATCH
"one of trump's accusers is bringing a train car full of people to the women's march",-1,-1,MATCH
"a talk with fabio viviani",-1,-1,MATCH
"invite your customer into the boardroom",-1,-1,MATCH
"twelve more pie-fucking movies in the works",1,-1,FAIL
"trump's army secretary pick is victim of 'gay gestapo,' right wing activists claim",-1,-1,MATCH
"area teen receives $2 from grandma",1,1,MATCH
"sellout crowd greets sellout band",1,1,MATCH
"these are the top 15 u.s. cities for couples, according to rent.com",-1,-1,MATCH
"australian asylum seekers told to choose life in jail or risk death in home countries",-1,1,FAIL
"this 'homoji'  keyboard brings queer shorthand to your text messages",-1,-1,MATCH
"'mass mobs' are taking over detroit's catholic churches",-1,-1,MATCH
"margaret thatcher's ashes scattered over free market",1,-1,FAIL
"russian jets in 'unsafe' encounters with destroyer: u.s. official",-1,1,FAIL
"kim jong-un comes out in support of gay marriage: 'i'm not a monster'",1,-1,FAIL
"ellie goulding perfectly sums up the sheer terror of panic attacks",-1,-1,MATCH
"kids and high sugar die-ts",-1,-1,MATCH
"new, improved obamacare program released on 35 floppy disks",1,1,MATCH
"anne hathaway to moms: 'there is no shame in gaining weight during pregnancy'",-1,1,FAIL
"joan moran: how to give yourself the gift of time",-1,-1,MATCH
"mick mulvaney, supporter of 2013 government shutdown, blames obama for that one",-1,1,FAIL
"six ways to support opposition in turkey",-1,-1,MATCH
"here is the 8th person who was at donald trump jr.'s meeting with russians",-1,-1,MATCH
"cocktail-party guest cornered by joel stein",1,1,MATCH
"word origin comics: the abc's of education",-1,-1,MATCH
"christian lgbtq group raises money to help pay for gender-affirming surgeries",-1,-1,MATCH
"warren buffett gives single largest charitable contribution",-1,1,FAIL
"a record number of people have drowned trying to reach europe this year",-1,-1,MATCH
"of course sean spicer's goodbye email contained a typo",-1,-1,MATCH
"troy aikman: i 'knock on wood' hoping i stay healthy after concussions",-1,-1,MATCH
"jay z hopes kalief browder's story will 'save a lot of lives'",-1,-1,MATCH
"trump hints at obamacare replacement that would look nothing like what republicans have in mind",-1,-1,MATCH
"these religions were born in the u.s.a.",-1,-1,MATCH
"this swimsuit model stuns from the neck up, for a refreshing change",-1,-1,MATCH
"the unforgettable memorial of warhol superstar holly woodlawn",-1,-1,MATCH
"the power of expectation",-1,-1,MATCH
"federal judges can't clear someone's record, even for minor, nonviolent offenses",-1,1,FAIL
"white house probes kushner business loans after ethics questions",-1,1,FAIL
"new clinton memoir: 'we all made mistakes but you made most of them'",1,1,MATCH
"oatmeal breakfast bars packed with protein",-1,1,FAIL
"budget cheat day lets government splurge on anything it wants once a week",1,1,MATCH
"blake lively explains the touching reason she joined the women's march",-1,-1,MATCH
"why is it so darn hard for women to lose that baby weight?",-1,-1,MATCH
"gop lawmaker matt gaetz slams haiti: 'sheet metal and garbage' everywhere you look",-1,-1,MATCH
"blissful ignorance commemorated on annual 9/10 anniversary",1,1,MATCH
"microsoft unveils next best thing to teleportation",-1,1,FAIL
"lesbian ex-mayor has perfect response to ann coulter's hurricane nonsense",-1,1,FAIL
"harry belafonte is really concerned about trump supporters",-1,-1,MATCH
"anderson cooper briefly speechless when gop strategist swears he's never heard trump lie",-1,-1,MATCH
"clinton reminds new yorkers she moved there hoping career dreams would work out too",1,1,MATCH
"uzo aduba's emmys dress is a work of art",-1,-1,MATCH
"exxonmobil swears it's going to start taxes early this year",1,1,MATCH
"exclusive video: sean hayes discovers family's criminal past",-1,1,FAIL
"navy discontinues use of 'port' and 'starboard'will now refer to left as 'thunk' and right as 'moosh-baroo'",1,1,MATCH
"obama debuts annoying catchphrase",1,1,MATCH
"how nice of dr. luke to now let kesha perform at the billboard music awards",-1,-1,MATCH
"aclu sues trump administration over voter fraud probe",-1,-1,MATCH
"old refrigerator unable to control when it releases water anymore",1,1,MATCH
"buyer of $450 million da vinci painting sort of assumed it would come with frame",1,1,MATCH
"magic-markered initials fail to deter breakroom rice-cake thief",1,1,MATCH
"my wakeup call from arianna huffington",-1,-1,MATCH
"the fashion world is really trying to make crocs 'it' shoes",-1,-1,MATCH
"rupaul is reinforcing the very thing his show is supposed to rebel against",-1,-1,MATCH
"how prepared are directors for the challenges of the nonprofit culture?",-1,-1,MATCH
"the real march madness: slashing student aid",-1,-1,MATCH
"dental hygienist angered by lack of flossing",1,1,MATCH
"how to spot your future ex-husband on the very first date",-1,-1,MATCH
"i refuse to put your teen on a diet",-1,-1,MATCH
"number of songs gop candidates can use down to 4",1,1,MATCH
"being moody helps us adapt to change",-1,-1,MATCH
"bertha cáceres: 'my mother's is not the first assassination. i don't want another'",-1,-1,MATCH
"why i'm buying a house without a family to put in it",-1,-1,MATCH
"will this be the china century?",-1,-1,MATCH
"artists announce they've found all the beauty they can in urban decay",1,-1,FAIL
"michigan residents are pretty unhappy with rick snyder",-1,-1,MATCH
"alpha trick-or-treater established by third house",1,1,MATCH
"8 reasons to travel this year",-1,-1,MATCH
"what happened when this writer matched with martin shkreli on tinder",-1,-1,MATCH
"why is a dairy farmer with no intel experience the house intelligence committee chairman?",-1,-1,MATCH
"police seize 250 pounds of marijuana smoker",1,-1,FAIL
"elizabeth warren calls for investigation of ny fed over secret tapes",-1,-1,MATCH
"senator baucus shows rest of congress where he found the dead body",1,-1,FAIL
"bank teller's bad spanish skills thwart attempted robbery",-1,1,FAIL
"america's love affair with jim breuer to start any day now",1,1,MATCH
"stop hating trump voters",-1,-1,MATCH
"remembering that may of 1963",-1,-1,MATCH
"shocking 'nashville' cliffhanger might be connie britton's swan song",-1,-1,MATCH
"awkward tension mistaken for sexual tension",1,-1,FAIL
"code word: is 'arrogant' the new 'uppity'?",-1,-1,MATCH
"randy and erika jackson split after 18 years of marriage",-1,-1,MATCH
"heartbreaking video shows starving polar bear on warming canadian island",-1,-1,MATCH
"4 crazy-good kebab recipes",-1,1,FAIL
"eric trump poses with carcass of safari guide shot on african hunting trip",1,1,MATCH
"rookie told to ease up on crime-scene tape",1,1,MATCH
"blue-collar democrats to party: it's still the economy, stupid",-1,-1,MATCH
"seed of world war iii planted in beijing middle-school gym class",1,1,MATCH
"seabed search for mh370 could end within a week",-1,-1,MATCH
"'matt shepard is a friend of mine,' and my son",-1,-1,MATCH
"suicide attack at methodist church in pakistan kills nine, wounds dozens",-1,-1,MATCH
"budweiser unveils social anxiety bottle with 900% more label to pick at",1,1,MATCH
"here's what 'all my life' singers k-ci & jojo look like now",-1,-1,MATCH
"americans approve of barack obama's legacy but don't necessarily want to see it continue",-1,1,FAIL
"meg gavin's gps guide for finding perspective",-1,1,FAIL
"amazon pulls racist 'slavery gets s**t done' products from website",-1,1,FAIL
"cable-tv judge overruled by network-tv judge",1,1,MATCH
"libertarian reluctantly calls fire department",1,1,MATCH
"nate berkus and jeremiah brent are married!",-1,-1,MATCH
"sole remaining lung filled with rich, satisfying flavor",1,1,MATCH
"florida atheist sets up anti-trump festivus pole at city's christmas display",-1,1,FAIL
"woman nervous mom starting to use her as confidant",1,1,MATCH
"man has pretty good idea which friend going to give up on dream first",1,1,MATCH
"khrushchev's granddaughter just compared trump to stalin",-1,-1,MATCH
"name on valentine misspelled",1,1,MATCH
"more than 1,300 law professors oppose jeff sessions for ag",-1,-1,MATCH
"ozzy osbourne bites head off five-pound chocolate rabbit",1,1,MATCH
"tea party plans to recruit more coloreds this fall",1,1,MATCH
"friend of friend better friend than friend",1,1,MATCH
"for all the girls i loved before i knew i could",-1,-1,MATCH
"lesser piece of paper used to test pen's viability",1,1,MATCH
"bollywood remake of fahrenheit 9/11 criticizes bush administration through show-stopping musical numbers",1,1,MATCH
"the 'here comes honey boo boo' scandal: mama june speaks out",-1,-1,MATCH
"extending your social media reach: working the facebook author tag feature",-1,-1,MATCH
"create the ultimate 'boomer cave' from your empty nest",-1,-1,MATCH
"nearly one million affected by flooding in myanmar",-1,1,FAIL
"chess grandmaster tired of people comparing every life situation to chess match",1,1,MATCH
"do trump voters continue to support repeal of obamacare?",-1,-1,MATCH
