File:,"../Sarcasm/Sarcasm_train_set_1.csv"
"health insurers fire volley in new battle over the public option",-1,-1,MATCH
"national poetry month raises awareness of poetry prevention",1,1,MATCH
"key california lawmaker steps down amid harassment claims",-1,-1,MATCH
"more employers may be using temps to skirt immigration laws",-1,-1,MATCH
"in his new act, tommy tune vows to be a 'vitamin for the spirit'",-1,-1,MATCH
"dhs: individual al-qaeda operative assigned to each american family",1,1,MATCH
"'gta v' a sophisticated gaming experience, says man who spent 3 hours running over homeless people with fire truck",1,-1,FAIL
"retreating clinton campaign torches iowa town to slow advance of sanders volunteers",1,1,MATCH
"lindsey graham's leaked voicemails are very revealing",-1,-1,MATCH
"white house increases security after man shows up at oval office looking for obama",1,1,MATCH
"verizon to bid $3 billion for yahoo's web assets: wsj",-1,-1,MATCH
"trees planted in poor neighborhood mature just in time for gentrification",1,1,MATCH
"miami police officer's facebook plea: 'everyone's life matters'",-1,-1,MATCH
"marco rubio's rivals take aim at his history on immigration",-1,-1,MATCH
"limbo for michael slager, ex-cop filmed shooting walter scott in the back",-1,-1,MATCH
"this is what happens when you search 'pumpkin spice' on nordstrom",-1,-1,MATCH
"this 'bear-naked' chef has a thing or two to show you about cooking",-1,-1,MATCH
"dog mauls owners after they tried to dress him in sweater: police",-1,-1,MATCH
"james holmes elected new nra president",1,-1,FAIL
"anthropologists unearth possible missing link between a- and b-list celebrities",1,-1,FAIL
"u.s. appeals ruling against trump's revised travel ban to higher court",-1,-1,MATCH
"permanent white house staff on edge about the 2016 presidential race",-1,-1,MATCH
"how to be superstar sports agent (part two)",-1,-1,MATCH
"10 stress-free suppers for the entire family",-1,-1,MATCH
"the single american woman",-1,-1,MATCH
"indian casino one of the saddest places on earth",1,-1,FAIL
"fans riot in streets as u.s. victorious",1,-1,FAIL
"rescue dog adopted for couple weeks",1,-1,FAIL
"'the late show' updated trump's election night speech with annotations",-1,-1,MATCH
"hillary clinton rode the new york city subway",-1,-1,MATCH
"they said, i'm sorry, because you weren't physically injured, you can't go to the private events.",-1,-1,MATCH
"report: it apparently time in conversation to smile, laugh",1,1,MATCH
"twitter reminds alec baldwin at least he has a job for next 4 years",-1,-1,MATCH
"this sweet (and sexy) adult coloring book is a gay valentine treat",-1,-1,MATCH
"thousands protest peacefully in baltimore, and many lend a helping hand",-1,-1,MATCH
"dozens of glowing exit signs mercilessly taunt multiplex employee",1,1,MATCH
"global markets plunge on oil, china fears",-1,-1,MATCH
"the only parenting advice i'd dare to give",-1,-1,MATCH
"migrant and refugee children find a home in greece's intercultural schools",-1,-1,MATCH
"nobody in ukraine notices absence of government",1,-1,FAIL
"historical archives: john jameson's miracle concoction",1,-1,FAIL
"what's it like waiting for donald trump to take office? a career federal employee spills the beans",-1,-1,MATCH
"woman barely jogging",1,1,MATCH
"pope francis scouring papal tombs for final easter egg of vatican hunt",1,1,MATCH
"bill nye slams cnn for putting climate change skeptic on earth day panel",-1,-1,MATCH
"scott bakula turns 43, newspaper reports",1,1,MATCH
"amy schumer says she 'would have loved to come out of' goldie hawn",-1,-1,MATCH
"state facing lawsuit over controversial law nullifying all federal gun regulations",-1,-1,MATCH
"here's one major way the senate is stuck in the past",-1,-1,MATCH
"americans respond to trump's plans for country with #nobannowall",-1,-1,MATCH
"half-empty bottle of colt 45 left on church steps must be offering to god",1,1,MATCH
"what might have been in 2017 had hillary clinton won",-1,-1,MATCH
"oil tanker explosion kills 146 people in pakistan",-1,-1,MATCH
"fda confirms psilocybin reduces risk of mindlessly following society's rules like fucking lemming",1,1,MATCH
"news van driver sick of helping anchors move",1,-1,FAIL
"naacp calls for more diversity in police lineups",1,-1,FAIL
"raffle ticket stared at with increasing disgust",1,-1,FAIL
"'true blood' characters openly talking about how they can't wait for episode to end",1,1,MATCH
"college football's 5 unexpected heisman trophy hopefuls",-1,-1,MATCH
"energy sector and epa nominee: oklahoma strong",-1,-1,MATCH
"the science-backed ways that  movement boosts your mood",-1,-1,MATCH
"emotional intelligence needs a moral rudder",-1,-1,MATCH
"denée benton, aka ruby on 'unreal,' is headed to broadway",-1,-1,MATCH
"astronaut tim peake completes london marathon in space, sets world record",-1,-1,MATCH
"mousy brunette removes glasses, becomes sizzling sexpot",1,-1,FAIL
"6 things i've decided to stop stressing about",-1,-1,MATCH
"the crawleys are back: why the world loves downton abbey",-1,-1,MATCH
"everyone giving up on john after latest movie recommendation",1,1,MATCH
"roller coaster designer's artistic vision sullied by fantastic four tie-in",1,1,MATCH
"john legend gushing about chrissy teigen and baby luna is just the cutest",-1,-1,MATCH
"fact repeated as urban legend",1,-1,FAIL
"must-see tv shows you can't miss this fall",-1,-1,MATCH
"immigrant mother receives pardon for minor driving conviction, but still could be deported",-1,-1,MATCH
"queen elizabeth ii to wed longtime partner following passage of gay marriage bill",1,-1,FAIL
"cuomo makes surprise afghanistan trip",-1,-1,MATCH
"the wsj's long record of protecting polluters",-1,-1,MATCH
"biden invokes freedom of information act to find out when woman gets off work",1,1,MATCH
"nutritionists recommend 3-4 daily servings of anything that's about to go bad",1,1,MATCH
"museum gift shop openly daring anyone to spend $450 on decorative geode",1,-1,FAIL
"a dirty little secret about my sex life",-1,-1,MATCH
"latest online security breach forces mom to change post-it",1,-1,FAIL
"lindsey graham stays up all night running campaign ideas by toll-free telephone operator",1,1,MATCH
"my hair was a stranger to me",-1,-1,MATCH
"apple will turn next iphone into wallet",-1,1,FAIL
"white house dishwasher tenders resignation",1,-1,FAIL
"heartbreaking rubio campaign email just asks supporters to send something to make him smile",1,1,MATCH
"group of hunky cardinals appeal to pope to relax celibacy requirement",1,1,MATCH
"5 extreme things the common core has done to children in the past 5 years, according to opponents",-1,-1,MATCH
"can california assemblyman/surfer travis allen ride a wave of voter discontent into the governor's office?",-1,-1,MATCH
"the pakistani friends and the foes of the new york times",-1,-1,MATCH
"marco rubio knows exactly what he's doing",-1,1,FAIL
"childhood friend stops writing after two e-mails",1,-1,FAIL
"congress passes antisocial insecurity act",1,-1,FAIL
"nfl pregame ceremony honors retired 52-year-old cornerback as oldest living former player",1,-1,FAIL
"internet jokester strikes again",1,-1,FAIL
"taylor swift mourns death of boyfriend christopher dorner",1,-1,FAIL
"anyone want to watch bill murray get sprayed with champagne?",-1,-1,MATCH
"the one moment you need to see from last night's 'peter pan live!'",-1,-1,MATCH
"9 things you're doing that drive your doctor crazy",-1,-1,MATCH
"free-thinking cat shits outside the box",1,-1,FAIL
"pepsi ceo's wife buys coke when she's mad at him",1,1,MATCH
"hand gestures transform friend's story into immersive virtual reality experience",1,1,MATCH
"john goodman's angry rex tillerson spews about being fired by a 'moron' on 'snl'",-1,-1,MATCH
"victoria's secret puts record number of asian models on its runway",-1,-1,MATCH
"2 democratic senators say neil gorsuch refused to meet with them",-1,-1,MATCH
"topless protester in spain grabs waxwork donald trump's crotch",-1,-1,MATCH
"clinton 'glad to be back in civilization again'",1,1,MATCH
"nigel, the lonely seabird, dies next to the concrete bird replica he loved for 5 years",-1,-1,MATCH
"lab partner wants to be sex partner",1,-1,FAIL
"these are the only 5 shoes you need in your closet this fall",-1,-1,MATCH
"ai scientists theorize existence of numbers greater than 1",1,1,MATCH
"do latino businesses pander to white customers?",-1,-1,MATCH
"kid with cancer hopes to realize dream of meeting competent oncologist",1,1,MATCH
"abused child running out of black crayon",1,1,MATCH
"gross doctors recommend drinking 8 warm cups of clam juice a day",1,-1,FAIL
"torture report: america conducts a moral reckoning.  next, moral repair?",-1,1,FAIL
"republicans craft health care plan to screw trump voters",-1,-1,MATCH
"watch: 'freakshow' star attempts life-threatening stunt",-1,-1,MATCH
"new iranian president really impressed with country's nuclear arms program",1,1,MATCH
"charter school advocates play the race card",-1,-1,MATCH
"argument between grandmas ends in shootout at texas walmart, cops say",-1,-1,MATCH
"strom thurmond begins preparing cabinet",1,-1,FAIL
"tearful anthropologists discover dead ancestor of humans 100,000 years too late",1,1,MATCH
"trump's statement on canceled london visit is full of falsehoods",-1,-1,MATCH
"huffpost appoints aman sethi as india editor-in-chief",-1,-1,MATCH
"scientists discover 6,000-year-old stain",1,1,MATCH
"maid of honor specifically selected for ability to take emotional beating",1,1,MATCH
"singapore's first female president will be a hijab-wearing muslim woman",-1,-1,MATCH
"boy scout officials: 'we believe all children, regardless of gender, deserve the opportunity to one day die alone in the woods'",1,1,MATCH
"f. gary gray likely to direct 'fast & furious 8'",-1,-1,MATCH
"every one of man's priorities unrecognizable to grandfather",1,1,MATCH
"what to do if you feel traumatized by the las vegas shooting",-1,-1,MATCH
"will tax reform close the gaps?",-1,-1,MATCH
"new nike deal ensures future for women's pro soccer in u.s.",-1,-1,MATCH
"janet jackson reportedly splits from wissam al mana",-1,-1,MATCH
"the dangers behind teen texting and driving",-1,-1,MATCH
"why i love my mom jeans",-1,-1,MATCH
"92% of area woman's holiday recipes involve pulverizing bag of oreos",1,1,MATCH
"teacher in cash-strapped ohio school district forced to make do with centuries-old firearms",1,-1,FAIL
"the robot apocalypse is looking pretty damn funky in new boston dynamics video",-1,-1,MATCH
"queen elizabeth rushed to hospital for royal blood transfusion",1,-1,FAIL
"'dsm-5' updated to accommodate man who is legitimately being ordered to kill by the moon",1,-1,FAIL
"america a fascist police state, stoned underage drunk driver charges",1,-1,FAIL
"skip the haunted houses, take a digital tour of abandoned buildings instead",-1,-1,MATCH
"top entrepreneurial business lessons i've learned",-1,-1,MATCH
"white house carefully screening any gun control town hall questions that address obama as 'mein führer'",1,1,MATCH
"debra messing doesn't want you to freak out about a 'will & grace' revival just yet (update)",-1,-1,MATCH
"c-suite men stepping down for 'work-life balance' is no step forward",-1,-1,MATCH
"karate studio hoping to get local phone number that spells out word 'kick' or 'chop'",1,1,MATCH
"supreme court agrees to disagree on abortion issue",1,-1,FAIL
"key republican puts dagger in push to end filibusters",-1,-1,MATCH
"robert pattinson & fka twigs spend time at chateau marmont",-1,-1,MATCH
"this adult take on a classic children's hairstyle is a must",-1,-1,MATCH
"chris christie distances himself from struggling trump campaign",-1,-1,MATCH
"none of area man's friends have ever seen him with shirt on",1,1,MATCH
"english teacher obviously hung over",1,-1,FAIL
"group cheers after group hears group's name called",1,-1,FAIL
"if grown-ups faced the same problems kids do",-1,-1,MATCH
"the limits of corporate citizenship: why walgreen shouldn't be allowed to influence u.s. politics if it becomes swiss",-1,-1,MATCH
"city adds some big concrete stairs",1,-1,FAIL
"someone's job riding on success of antacid gum",1,1,MATCH
"10 million fans killed off in sopranos season premiere",1,-1,FAIL
"moderation and modernity: challenges for moroccan islam",-1,-1,MATCH
"mortgage market collapse threatens nation's banner ad industry",1,1,MATCH
"el chapo pleads not guilty to drug charges",-1,1,FAIL
"chuckling cops attempt to imitate sound of man being hit by taxi",1,1,MATCH
"huffpost rise: what you need to know on december 9",-1,-1,MATCH
"local welder suffering from welder's block",1,1,MATCH
"dutch heath authorities to kill 8,000 ducks to prevent bird flu",-1,-1,MATCH
"twitterverse trolls marco rubio over his 'fool' bible verse tweet",-1,-1,MATCH
"dozens of gravestones toppled, broken at philadelphia jewish cemetery",-1,1,FAIL
"teen learns the negligible value of a dollar",1,-1,FAIL
"dive-bombing osprey better emerge from lake with something awesome to show for it",1,1,MATCH
"american muslims are fearful but resilient about their place in trump's america",-1,-1,MATCH
"triumph of human engineering slept through",1,1,MATCH
"bitcoin on path to functioning just like real currency after small concentration of people acquire majority of it",1,1,MATCH
"at least 16 killed in deadly attack at ivory coast resort town",-1,-1,MATCH
"aunt threatens to devour helpless newborn's toes",1,-1,FAIL
"everyone is in love with shawn mendes after iheartradio music awards performance",-1,-1,MATCH
"behold a tatted up zayn malik",-1,-1,MATCH
"a stunning look inside an abandoned french chateau",-1,-1,MATCH
"woman going to take quick break after filling out name, address on tax forms",1,1,MATCH
"gop completely fixes economy by canceling funding for npr",1,-1,FAIL
"special counsel robert mueller probing trump business transactions: report",-1,-1,MATCH
"sources: you don't want to know what currently happening to saudi arabian woman",1,-1,FAIL
"tea party candidate doesn't want to be associated with the tea party",-1,-1,MATCH
"the sec, cftc and the real-time risks in today's markets",-1,-1,MATCH
"billy bush reportedly out at 'today' and negotiating exit from show",-1,-1,MATCH
"al jazeera america to shut down by end of april",-1,1,FAIL
"north korea releases new paintings of healthy kim jong il",1,-1,FAIL
"national board of steve jaskoviak requests $10 billion bailout",1,1,MATCH
"tall young girl told she should play basketball",1,-1,FAIL
"my lust for the little frenchie!",-1,-1,MATCH
"chuck schumer admits democrats need to do more to show americans what they stand for",-1,-1,MATCH
"watch katy perry's hilarious segway fail at burning man",-1,1,FAIL
"nba free agency winners and losers",-1,-1,MATCH
"my mother hated tattoos, so naturally i got one for her",-1,-1,MATCH
"the lawsuit against black lives matter and the central meaning of the first amendment",-1,-1,MATCH
"james corden shuts down bill o'reilly's slavery comments",-1,-1,MATCH
"silence your thoughts with this simple technique",-1,-1,MATCH
"room scanned for something to sell on ebay",1,1,MATCH
"former commish michael copps: 'maybe the worst fcc i've ever seen'",-1,-1,MATCH
"hammering away at illegal immigration from central america",-1,-1,MATCH
"kim davis's anti-gay views are going to cost her state big time",-1,-1,MATCH
"doctors are getting more engaged in the gun violence debate, but it's not rocket science",-1,-1,MATCH
"trapped chilean miners considering how funny it would be if they all died right as rescuers completed tunnel",1,1,MATCH
"dems discuss dropping wasserman schultz",-1,-1,MATCH
"an iowa teenager didn't wreck his state's health care market. here's who did.",-1,-1,MATCH
"gop operatives aren't so sure that trump even wants to win",-1,-1,MATCH
"white house warns syria against launching another chemical weapons attack",-1,-1,MATCH
"'me and mrs. jones' singer billy paul has died",-1,-1,MATCH
"dad locks into elaborate chess match with lawn mower salesman",1,1,MATCH
"trump's mini-surge",-1,-1,MATCH
"the lesbians that founded the gay village and the mafia alliance they made for protection",-1,-1,MATCH
"mom who drove kids into ocean gives birth",-1,1,FAIL
"r.l. stine releases 'goosebumps' titles his publisher rejected",-1,-1,MATCH
"trump and america's big black eye",-1,-1,MATCH
"surgeon general warns teens cinnamon challenge is not for pussies",1,-1,FAIL
"vacationing secretary of homeland security asks neighbor to keep eye on nation over weekend",1,1,MATCH
"afeni shakur showed the power of black motherhood",-1,-1,MATCH
"americans overwhelmingly say it's ok to criticize the president",-1,-1,MATCH
"james corden and the red hot chili peppers strip down for 'carpool karaoke'",-1,-1,MATCH
"putin starts off morning by sitting down to write the day's news",1,-1,FAIL
"baby put on phone told her parents hate her",1,-1,FAIL
"we reached out to other clients of louis c.k.'s manager and got radio silence",-1,-1,MATCH
"russian bobsledder nadezhda sergeeva fails doping test",-1,-1,MATCH
"man on rolling swivel chair pushes away from desk like blue angel breaking formation",1,1,MATCH
"kinki university to change its name because you know why",-1,-1,MATCH
"chaps unnecessary",1,-1,FAIL
"travel ban is a minor win for trump and a major loss for human rights",-1,-1,MATCH
"an army of sophisticated bots is influencing the debate around education",-1,-1,MATCH
"things heat up in the kitchen when 12-year-old busts out moves we didn't see coming",-1,-1,MATCH
"12 ways to make your divorce as expensive as possible",-1,-1,MATCH
"donald trump injects yet another conspiracy theory into 2016 news cycle",-1,-1,MATCH
"democrats demand that devos explain how she is going to protect trans students",-1,-1,MATCH
"single mother hogging 2 jobs",1,-1,FAIL
"who is hacking all of these 'glee' stars?",-1,-1,MATCH
"tom petty's last tour included a subtle nod of support for trans rights",-1,-1,MATCH
"'toy story 4' coming to theaters in 2019",-1,1,FAIL
"is the two-state concept still alive in israel?",-1,-1,MATCH
"lgbt christians speak out: 'love the sinner, hate the sin' won't cut it anymore",-1,-1,MATCH
"obama sleeping with louisville slugger under bed now",1,1,MATCH
"a review: 'one teen story'",-1,-1,MATCH
"has lgbtq pride lost its way?",-1,-1,MATCH
"7-year-old transfers friend's obituary onto silly putty for posterity",1,-1,FAIL
"the death of email",-1,-1,MATCH
"schwarzenegger running out of movie-related campaign slogans",1,1,MATCH
"group of christie campaign deserters found in forest",1,1,MATCH
"the must see attraction of 2015 in vegas",-1,-1,MATCH
"bernie sanders is running against hillary clinton and losing against time",-1,-1,MATCH
"anti-defamation league will use donald trump's donations to fund anti-bullying programs",-1,-1,MATCH
"a brief history of hollywood's complicated relationship with cocaine",-1,-1,MATCH
"5 things i miss most about marriage but never want again",-1,-1,MATCH
"8 ways to recommit to your fading resolutions",-1,-1,MATCH
"panicked newborn didn't realize breathing would be on apgar test",1,-1,FAIL
"bee attack sends 3 to the hospital",-1,-1,MATCH
"bisexual: the new 'it' word",-1,-1,MATCH
"mildfires amble through california",1,1,MATCH
"protagonist rapidly getting dressed must be late, reports cunning viewer recognizing film's subtext",1,1,MATCH
"mom saw a bunch of photos from women's march online",1,-1,FAIL
"nation confused after james comey dedicates entire memoir to in-depth retelling of martha stewart insider trading controversy",1,1,MATCH
"the peterson farm bros' beef with chipotle (part 4): the definition of ethical behaivor",-1,-1,MATCH
"this valentine's day, more americans are searching for love online",-1,-1,MATCH
"trans woman covers women's running body issue",-1,1,FAIL
"good cop, avid-stamp-collector cop routine not working",1,1,MATCH
"women's group uses drones to deliver abortion pills",-1,-1,MATCH
"seth meyers ridicules mike pence for going all 'love actually' on trump",-1,-1,MATCH
"'get tivo' friend's solution to everything",1,1,MATCH
"this photo of mark zuckerberg's closet offers a lesson for working parents",-1,-1,MATCH
"first-grade teacher apprehends urinator",1,-1,FAIL
"baby takes political stance",1,-1,FAIL
"mariah carey rings in 2017 with painful lip sync fail on live tv",-1,-1,MATCH
"a nobel prize for sustainable fashion",-1,-1,MATCH
"hedge those bets: sports gambling may not be a jackpot for states",-1,-1,MATCH
"25-pound ham wedged in parents' refrigerator",1,-1,FAIL
"trump responds to supreme court abortion ruling",-1,-1,MATCH
"3 simple ways to relieve holiday tension with tai chi",-1,-1,MATCH
"focus group reveals: 95 percent of americans would like to go home",1,1,MATCH
"mike pence disappointed god has never asked him to kill one of own children",1,1,MATCH
"senate bill aims to lock hackers out of connected cars",-1,-1,MATCH
"t.g.i. friday's executive chef recommends booze-on-meat-with-cheese thing",1,1,MATCH
"autonomy: the self-driving car and you",-1,-1,MATCH
"heinz introduces industrial-sized ketchup packet",1,1,MATCH
"evening's events immediately recapped with digital-camera slide show",1,-1,FAIL
"punk legend gives 'nazi punks f**k off' an update just for donald trump",-1,-1,MATCH
"mind-boggling optical illusion will make you think you can't see straight",-1,-1,MATCH
"martini, rossi slain by anti-spumanti extremists",1,1,MATCH
"sexual assault report drops from white house site, remains on obama archive (update)",-1,-1,MATCH
"police officer who killed unarmed motorist cleared of all charges",-1,-1,MATCH
"psychologists push for smartphone warning labels",-1,-1,MATCH
"5 signs your hair color choice is making you look duller and older",-1,-1,MATCH
"therapist beginning to show cracks in caring façade",1,1,MATCH
"5-year-old reluctantly lets crying mom sleep in his bed again",1,-1,FAIL
"cornel west: obama 'posed as a progressive & turned out to be counterfeit'",-1,-1,MATCH
"(still) daring to be different in dr. martens",-1,-1,MATCH
"posthumously recorded bob dylan album receives rave reviews",1,-1,FAIL
"watch live:  equal pay day rally with powher ny at city hall",-1,-1,MATCH
"nelson mandela admits thoughts, prayers of millions played no part in recovery",1,1,MATCH
"u.s. military: firefight with taliban caused civilian deaths, but troops acted in self-defense",-1,-1,MATCH
"po' boy $12",1,-1,FAIL
"panicked malcolm gladwell realizes latest theory foretells end of his popularity",1,-1,FAIL
"applebee's to offer divorced-father-and-child specials every other weekend",1,1,MATCH
"new altar boy clearly not ready for spotlight of 10 a.m. sunday mass",1,1,MATCH
"who declares ebola outbreak after democratic republic of the congo confirms 2 cases",-1,-1,MATCH
"ancient gravestone used as battering ram in lightning jewelry store heist",-1,-1,MATCH
"hero shop saves hundreds from hunger",1,-1,FAIL
"banks introduce 75-cent surcharge for using word 'bank'",1,-1,FAIL
"bruce vilanch sodomized by homosexual",1,1,MATCH
"if you see a muslim at the airport",-1,-1,MATCH
"michelle obama quietly reassigned to department of agriculture after butting heads with president",1,1,MATCH
"airline passengers tackle man who rushes cockpit in bomb threat",-1,1,FAIL
"youth homelessness is an invisible issue, but it doesn't have to be",-1,-1,MATCH
"when you google 'why do women ...' some very interesting results come up",-1,-1,MATCH
"firefighters save baby hamsters with teeny 'oxygen masks'",-1,-1,MATCH
"gay marriage finds scant mention among republicans at values voter summit",-1,-1,MATCH
"j.crew debuts new line of stylish casualwear for mannequins",1,1,MATCH
"'god fucking dammit, you're a stupid fucking moron,' whispers woman who realizes she missed ice dancing",1,-1,FAIL
"grandma in nursing home starts adorable little sexual relationship",1,1,MATCH
"nation's economic recovery hinging on success of diet vanilla coke",1,1,MATCH
"wednesday's morning email: conservatives aren't loving the proposed gop obamacare reform",-1,-1,MATCH
"king ralph fails to become hip retro reference",1,-1,FAIL
"man pinned beneath car wondering when adrenaline going to kick in",1,1,MATCH
"pope francis worried about job security after butting heads with new god",1,1,MATCH
"man busted for selling drugs and stolen guns from driveway, feds say",-1,-1,MATCH
"connection, mission, game: your best friends",-1,-1,MATCH
"'the chew' co-host wants her kids to know moms can be more than mothers",-1,-1,MATCH
"horseconnect, the social network for horses, bought for $1 billion",1,-1,FAIL
"alec baldwin's trump impression is apparently even better than we thought",-1,-1,MATCH
"'portlandia' debuts new mra anthem, because life is hard for white dudes",-1,-1,MATCH
"texas won't stop denying immigrants' children birth certificates -- for now",-1,-1,MATCH
"clear theme of obedient children emerging in father's bedtime stories",1,1,MATCH
"out-of-control scott walker injured after wildly careening between stances on immigration",1,1,MATCH
"yes, my child with special needs understands you -- please talk to him",-1,-1,MATCH
"congress discontinues festival seating after insurance-deregulation-bill stampede",1,-1,FAIL
"people on the internet can't stop making fun of tom hiddleston's 'i heart ts' top",-1,-1,MATCH
"newspaper scraps references to gay man's husband in his mom's obituary",-1,-1,MATCH
"eric cantor pressuring wife to try new political position",1,1,MATCH
"the progressive 'legend of korra' finale made fans very happy",-1,-1,MATCH
"new carl's jr. bedtime burger designed to be eaten while asleep",1,1,MATCH
"how to rekindle a lost passion in your life",-1,-1,MATCH
"gop sen. jeff flake comes out and says it: 'my party might not deserve to lead'",-1,-1,MATCH
"young democrats prefer bernie sanders, new poll finds",-1,-1,MATCH
"new edition of bible specifically mentions second amendment",1,1,MATCH
"friday talking points -- gop anti-trump rants",-1,-1,MATCH
"trump brings back 'pocahontas' slur of elizabeth warren at event for native american veterans",-1,-1,MATCH
