File:,"../Sarcasm/Sarcasm_train_set_4.csv"
"tom hanks in carly rae jepsen's 'i really like you' video is oddly entertaining without music",-1,-1,MATCH
"catholic teens still coming down after excitement of world youth day",1,1,MATCH
"new, lighter iphone hailed by exhausted, humpbacked iphone 4 users",1,1,MATCH
"gun used to kill man in city",1,1,MATCH
"filming police in public places: a risky first amendment activity for citizen journalists",-1,-1,MATCH
"rural south dakotan walks away from first encounter with jewish man, shaken but unharmed",1,-1,FAIL
"new historical evidence suggests most pilgrims sailed back home to celebrate first thanksgiving",1,1,MATCH
"john orozco breaks down after qualifying for usa gymnastics team",-1,1,FAIL
"iran ready to talk about how awesome nuclear program is",1,-1,FAIL
"the best men's sunglasses looks for summer",-1,-1,MATCH
"pastor talking to non-christian who just lost wife can smell blood",1,1,MATCH
"donald trump, we need to talk about what a poll is",-1,-1,MATCH
"proud to be a total b*tch",-1,-1,MATCH
"pope francis prays at jerusalem's western wall",-1,1,FAIL
"colorado's new revenge porn statute is good law and sound policy",-1,-1,MATCH
"elmore leonard, modern prose master, noted for his terse prose style and for writing about things perfectly and succinctly with a remarkable economy of words, unfortunately and sadly expired this gloomy tuesday at the age of 87 years old",1,-1,FAIL
"t.i. calls for boycott of restaurant after off-duty cop allegedly assaults 3 black women",-1,-1,MATCH
"pope francis trains for easter mass by dragging pew loaded with rocks across snow",1,1,MATCH
"darrelle revis to be charged in fight that leaves two men unconscious",-1,-1,MATCH
"charles durning hocks up four-pound chunk of phlegm",1,1,MATCH
"lindsey graham asks nearby family to take his picture for photo op",1,-1,FAIL
"video shows london marathoner helping fellow runner over finish line",-1,-1,MATCH
"david axelrod's view inside the economic storm obama inherited in 2009",-1,-1,MATCH
"#mewesyria: resistance and hope",-1,-1,MATCH
"hillary's email, hillary's truth",-1,1,FAIL
"julianne hough lived in pain for years because of endometriosis",-1,1,FAIL
"to read or not to read, part 2",-1,-1,MATCH
"confederate flag doesn't fly with california lawmakers",-1,-1,MATCH
"leader of sea-doo riders holds court in middle of lake",1,1,MATCH
"in defense of the promposal",-1,-1,MATCH
"terrified laptop wakes up inside case",1,1,MATCH
"jimmy fallon could barely keep it together during this cardi b interview",-1,-1,MATCH
"behold, chris christie's fawning 'interview' with donald trump",-1,-1,MATCH
"the conundrum of the midterms",-1,-1,MATCH
"violinist sick of doing mozart covers",1,1,MATCH
"dozens of leads, no arrests in ferguson police shooting",-1,-1,MATCH
"firefighters turned away from exclusive nightclub blaze",1,1,MATCH
"russia's power shut off",1,1,MATCH
"guy just totally smoking weed on street",1,1,MATCH
"report: texting while driving okay if you look up every couple seconds",1,1,MATCH
"a tribute to david goldberg: entrepreneur, connector, mensch",-1,-1,MATCH
"local senior brutally folded in craftmatic adjustable bed accident",1,1,MATCH
"10 days that shook the regressive world",-1,-1,MATCH
"what will the disruption of politics look like?",-1,-1,MATCH
"isis vs isil -- what's in a name?",-1,-1,MATCH
"screaming japanese schoolgirls overturn greenspan's bus",1,1,MATCH
"study finds eating doctor after birth can provide essential nutrients to new mothers",1,1,MATCH
"chrissy teigen would like everyone to stop worrying about her baby, thanks",-1,1,FAIL
"dog, cat and squirrel drama escalates in a hurry",-1,-1,MATCH
"it's mildly infectious and treatable─yet patients still face discrimination",-1,-1,MATCH
"woman only willing to learn new things in settings called boot camp",1,1,MATCH
"these vertigo-inducing photographs will take your breath away",-1,-1,MATCH
"mueller ain't going away",-1,1,FAIL
"drake's super bowl ad makes you wanna call someone on your cell phone",-1,-1,MATCH
"report: mom would rather sit here and watch you guys have fun",1,-1,FAIL
"new poll finds 80% of americans would just fucking destroy pan of brownies",1,1,MATCH
"if the us wants arabs as partners, we must treat them as such",-1,-1,MATCH
"why a democrat is now blocking an obama nominee",-1,-1,MATCH
"there's going to be a huge queer dance protest outside of ivanka trump's house",-1,-1,MATCH
"here's the smart thing the nfl is doing to fix its dumb catch rule",-1,-1,MATCH
"kate mckinnon kills as laura ingraham on 'saturday night live'",-1,1,FAIL
"god scores another free balloon some dumb kid let go of",1,1,MATCH
"scientists discover eating serves function other than easing anxiety",1,1,MATCH
"decorative throw pillow positively aching for a quick plump",1,-1,FAIL
"ross ice shelf embarks on world tour",1,1,MATCH
"man takes free thing he doesn't want",1,1,MATCH
"jedi chipmunks fight with lightsabers, universe wins",-1,-1,MATCH
"inside amazon: wrestling big ideas in a bruising workplace",-1,-1,MATCH
"progressive charter school doesn't have students",1,-1,FAIL
"mark zuckerberg: 'i regret' rejecting idea that facebook fake news altered election",-1,-1,MATCH
"area cockroach fucking huge",1,1,MATCH
"skywriter leaves suicide note",1,1,MATCH
"u.s. cities aren't ready to fend off the next flint",-1,1,FAIL
"area man, woman each have thorough list of why they should break up on standby",1,1,MATCH
"revised patriot act will make it illegal to read patriot act",1,1,MATCH
"a museum in germany is asking designers to give peace a new sign",-1,-1,MATCH
"doctors reveal dick cheney burning through at least 3 hearts each week",1,1,MATCH
"eminem rips nra in a rap: 'they love their guns more than our children'",-1,-1,MATCH
"in memory of the ms st. louis",-1,-1,MATCH
"meet the other baldwin brother, james!",1,-1,FAIL
"sea lion rescued from santa barbara oil spill dies at seaworld",-1,-1,MATCH
"unconditional love given to 15-year-old who just called mom a bitch in middle of hollister",1,-1,FAIL
"steven spielberg says netflix films shouldn't qualify for oscars",-1,-1,MATCH
"4 high-level languages for front-end developers",-1,-1,MATCH
"people with disabilities have a hard time finding jobs, and this company is doing something about it",-1,-1,MATCH
"only positive statistic of year announced",1,1,MATCH
"report: media coverage of bear attacks may be biased",1,1,MATCH
"archaeologists: egyptian pyramids actually early attempt at camping",1,1,MATCH
"congrats! you've been auto-enrolled -- now what?",-1,1,FAIL
"don lemon on sean spicer: everyone 'is dumber for having listened to that'",-1,1,FAIL
"explosion at fedex facility outside san antonio may be linked to austin bombings, fbi says",-1,-1,MATCH
"chuck grassley is keeping details of his iowa events secret to avoid protesters",-1,-1,MATCH
"celine dion served luxurious cat food in crystal goblet",1,1,MATCH
"this prairie city deserves your travel dollars. here's why.",-1,-1,MATCH
"obama to announce new climate change help for island nations",-1,-1,MATCH
"paula jarrel's gps guide for expressing self compassion",-1,1,FAIL
"'no way to prevent this,' says only nation where this regularly happens",1,1,MATCH
"miley cyrus' bangerz tour is coming to your living room tonight",-1,-1,MATCH
"7 sweet treats for mother's day",-1,-1,MATCH
"1/5 of u.s. adults live in or near poverty",-1,1,FAIL
"popular new amazon service just comes to your house and kills you",1,-1,FAIL
"drunken man careens wildly across internet",1,1,MATCH
"hang-glider gang terrorizes elderly hot-air-ballooning couple",1,1,MATCH
"all of the wacky and wonderful royal wedding memorabilia you can buy",-1,-1,MATCH
"seaworld's new ad is completely full of it",-1,1,FAIL
"man builds 'star trek'-themed cabin out of junk",-1,1,FAIL
"breaking: israelites in sinai suddenly achieve freedom from pharaoh -- good times forecast",-1,-1,MATCH
"this parody is for every parent whose kid hated taking pics with santa",-1,-1,MATCH
"eleven-year-old has miniskirt, pumps, vague notion of what sex is",1,-1,FAIL
"the anti-gay right can't run forever from its history of bigotry",-1,-1,MATCH
"us dietary guidelines: historic battle for people and planet",-1,-1,MATCH
"muslim woman berated at heritage event speaks out on independence day",-1,1,FAIL
"rory feek says watching his daughter grow up better than a grammy win",-1,-1,MATCH
"parents surprised cruel teen daughter hasn't pushed classmate to breaking point yet",1,1,MATCH
"with police body cameras, d.c. mayor promises transparency with caveats",-1,-1,MATCH
"leno to tell outrageous o.j. joke",1,1,MATCH
"fbi quickly follows up on tip about potentially dangerous man who killed 17 in school shooting",1,-1,FAIL
"dickipedia: founder of bikram yoga",-1,1,FAIL
"philly cheesesteak either perfect or disgusting",1,-1,FAIL
"texas governor legalizes previously banned wrestling move",1,-1,FAIL
"this cfl player takes unsportsmanlike conduct to another level",-1,-1,MATCH
"10 lies everyone tells you about paris",-1,-1,MATCH
"cnn's ana navarro says michelle wolf's critics are acting like 'snowflakes'",-1,-1,MATCH
"restaurant reacts perfectly to diners who were rude to employee with autism",-1,1,FAIL
"palin brushing up on foreign policy at epcot",1,1,MATCH
"'the scream' returns from two-year vacation relaxed",1,1,MATCH
"moderator asks candidates to be specific when describing hellscape country will become if they not elected",1,1,MATCH
"quinoa black bean burger: layers of flavor and packed with protein",-1,-1,MATCH
"mom hasn't said full, uninterrupted sentence to family since 1997",1,1,MATCH
"stephen colbert nails the nra's complete hypocrisy in a single sentence",-1,-1,MATCH
"it's been a really great year for poop bags",-1,-1,MATCH
"why underwater homeowners won't be saved by bank of america's $17 billion deal",-1,-1,MATCH
"conservative media throw virginia gop candidate under the bus after election loss",-1,-1,MATCH
"an introvert's guide to throwing a solid holiday party",-1,-1,MATCH
"nation breathes sigh of continuing unease",1,1,MATCH
"travis kalanick takes leaves of absence from post as uber ceo",-1,1,FAIL
"nepal calls: part three",-1,1,FAIL
"miss france iris mittenaere wins miss universe crown",-1,1,FAIL
"scientists crack mystery of tiny traveling plants",-1,1,FAIL
"steve bannon's inflamed liver pulsing visibly through shirt during strategy meeting",1,1,MATCH
"illinois neglects child care payments for needy families",-1,1,FAIL
"bill cosby mug shot released",-1,1,FAIL
"joe kennedy iii reveals how his gop counterparts really feel about donald trump's tweets",-1,-1,MATCH
"boilermakers protest purdue's mascot",1,1,MATCH
"fight kind of runs out of steam 15 seconds in",1,1,MATCH
"black women are rising ─ when will our pay?",-1,-1,MATCH
"state of emergency declared at new york city's housing authority",-1,1,FAIL
"conservationist known for exposing ivory & rhino trade stabbed to death",-1,1,FAIL
"new healthier menu features food wendy's customers bring from home",1,1,MATCH
"can america be saved?: how did 'yes, we can!' become 'no, we couldn't'? (part one)",-1,-1,MATCH
"#trybeatingmelightly shows pakistani women won't stand for wife-beating bill",-1,-1,MATCH
"new envelope pushes envelope envelope",1,1,MATCH
"the secret to speaking 'teen'",-1,-1,MATCH
"mccain blasts obama as out of touch in burma-shave-style billboard campaign",1,1,MATCH
"urban polling stations urge voters to immediately get back in line for general election",1,1,MATCH
"fox news struggling to attract younger 60-75 demographic",1,1,MATCH
"video game boss thinking he should get big glowing weak spot on back checked out",1,1,MATCH
"senior pretty checked out during entire final year",1,1,MATCH
"can caribbean cricket get its (political) groove back?",-1,-1,MATCH
"'game of thrones' star reveals tormund's love for brienne extends off screen",-1,-1,MATCH
"texas latinos overwhelmingly support abortion rights",-1,-1,MATCH
"south syria ceasefire and the next israel-hizballah-iran war",-1,-1,MATCH
"psychologists advise practicing words 'president trump' over next 2 months to prepare for inauguration",1,-1,FAIL
"'farm aid aid' concert to benefit struggling farm aid concerts",1,1,MATCH
"cat likes it doggy style",1,1,MATCH
"patriotic betrayal in the 1960s -- when the cia turned students into spies",-1,-1,MATCH
"it's snowing in hawaii right now, and we can't wait to visit",-1,-1,MATCH
"vatican issues first comments on trump's immigration ban",-1,-1,MATCH
"new ad hammers trump as too impulsive to allow near the nuclear button",-1,-1,MATCH
"read the full text of donald trump's executive order limiting muslim entry to the u.s.",-1,-1,MATCH
"bush increasingly focused on how revisionist history will see him",1,1,MATCH
"yahoo's newfront pulses to steve aoki's edm beat",-1,1,FAIL
"ctrl+ plus: a closer look at amc's halt and catch fire",-1,-1,MATCH
"nation to wait for more facts on texas shooting before doing absolutely nothing about it",1,1,MATCH
"the end of shared sacrifice set in stone: yale as metaphor",-1,-1,MATCH
"man has story for every stain on pants",1,1,MATCH
"man wishes there wasn't so much blank room on anniversary card",1,1,MATCH
"romney campaign reboots for 72nd consecutive week",1,1,MATCH
"senate bill may answer a decades-old request",-1,-1,MATCH
"the peace process is dying at the hands of israel with help from hamas",-1,-1,MATCH
"the 7 stages of potty training",-1,-1,MATCH
"woman enters miss universe malaysia after finding beauty in her head-to-toe moles",-1,-1,MATCH
"man accused of urinating on cop after yelling 'f*** trump'",-1,1,FAIL
"fifth-grader writes 'mrs. alan greenspan' all over her notebook",1,-1,FAIL
"ted cruz beats back donald trump in two states, shifting race",-1,-1,MATCH
"kanye west scrubs entire twitter account of any mention of trump",-1,-1,MATCH
"yes, trump has the power to launch a nuclear attack on his own",-1,-1,MATCH
"live election coverage: watch as midterm results pour in",-1,-1,MATCH
"mother constantly worried about son stationed on u.s. military base",1,1,MATCH
"trump keeps citing a paris agreement study that seriously misses the point",-1,-1,MATCH
"rupaul on trump: 'pardon me madame, but the emperor has no clothes!'",-1,-1,MATCH
"donald glover's 'this is america,' through the eyes of a jim crow historian",-1,-1,MATCH
"casual drink with acquaintance actually first move in elaborate chess game to get hired at united.com",1,1,MATCH
"fellow millennial voters: no one owes us a damn thing",-1,-1,MATCH
"obama peddling stimulus package door-to-door",1,1,MATCH
"otto warmbier, u.s. student freed from north korea, has 'severe' neurological injury",-1,1,FAIL
"obama orders flags at half-staff to honor victims of oregon shooting",-1,-1,MATCH
"fishing tycoon known as 'the codfather' will plead guilty to conspiracy and smuggling charges",-1,-1,MATCH
"donald trump is unqualified to be president, majority of american voters say",-1,-1,MATCH
"wrinkly, oversized trench coat returns to stage for 34th season with local community theatre",1,1,MATCH
"man checks to make sure no one home before recording song into laptop",1,1,MATCH
"here's why miley cyrus is my non-straight, non-binary role model",-1,-1,MATCH
"researchers discover new source of airborne antibiotic-resistant bacteria",-1,1,FAIL
"high school won't allow gay student to receive scholarship at awards dinner",-1,1,FAIL
"an unexpected heirloom",-1,-1,MATCH
"clinton's sight restored",1,1,MATCH
"about that woman vp candidate: klobuchar works better than warren",-1,1,FAIL
"picture of iphone used as iphone wallpaper",1,1,MATCH
"we're spending less on health care than we thought we would before obamacare",-1,-1,MATCH
"at least 23 ethical issues are dogging epa administrator scott pruitt",-1,-1,MATCH
"prince cremated, private ceremony held with family and friends",-1,-1,MATCH
"9,000 animals rescued from 'worst torture operation' in the u.s.",-1,-1,MATCH
"registered sex offender allegedly caught working as petco santa claus",-1,1,FAIL
"racists charged in terror plot against somali refugees get a nearly all white jury",-1,-1,MATCH
"texas hospital sued over ebola training seeks dismissal of the lawsuit",-1,-1,MATCH
"video shows security guard choking black teen accused of shoplifting in new york",-1,-1,MATCH
"portraits of librarians celebrate america's bookish unsung heroes",-1,1,FAIL
"cinephiles will love 'listen up philip'",-1,-1,MATCH
"trump spends entire classified national security briefing asking about egyptian mummies",1,-1,FAIL
"nascar logo slowly creeping across u.s.",1,1,MATCH
"a real phish nye miracle",-1,-1,MATCH
"watch macklemore's thoughtful commentary on race in america",-1,-1,MATCH
"al roker slams 'moron' jim inhofe for bringing snowball to senate",-1,-1,MATCH
"area man switches to backup lie",1,1,MATCH
"huffpost hill - 'rand paul tongue guy' now a thing",-1,-1,MATCH
"ted cruz didn't disclose goldman sachs loan during senate campaign",-1,-1,MATCH
"group of goth kids claims to see ghost of old man at cemetery",-1,1,FAIL
"ben affleck defends decision to set 'argo' in boston",1,-1,FAIL
"billy bob thornton on being raised by a psychic mom",-1,-1,MATCH
"chemistry lessons for leaders",-1,1,FAIL
"the women's march inspired them to run. now they're unseating gop men.",-1,-1,MATCH
"uncool zookeeper won't let anyone ride gorillas",1,-1,FAIL
"report: consumer confidence in amorphous, indefinable idea of economy highest since 2006",1,1,MATCH
"the rise and fall of an algerian tycoon",-1,-1,MATCH
"former conservative recalls belittling tirade from college student that brought him over to left",1,-1,FAIL
"that time kendall jenner got a pony for christmas",-1,-1,MATCH
"these quotes from kids are hilarious, adorable and oddly insightful",-1,-1,MATCH
"surviving and thriving through adversity: a transgender bathroom and hiv love story",-1,-1,MATCH
"dr. oz, mel gibson, & congress called out using steve buscemi and an adorable puppy",-1,-1,MATCH
"let's raise a glass to pink for gleefully slamming the troll who hacked her instagram",-1,-1,MATCH
"past armageddon and on to zippori, one of israel's premier archaeological sites: spring break 2016, breaking bad on the looney front - part 1",-1,-1,MATCH
"woman goes on rant over veteran's service dog in restaurant",-1,1,FAIL
"local band finds great photo for flier",1,1,MATCH
"barbra streisand says it was 'heartbreaking' to see hillary clinton lose the election",-1,-1,MATCH
"8 holiday beauty hacks every woman should know",-1,-1,MATCH
"sleazy health insurance covers any doctor's visit they can watch",1,-1,FAIL
"donald trump renews call for courts to reinstate travel ban after london incident",-1,-1,MATCH
"creepy late-night mortgage ad gives insight into true state of economy",1,1,MATCH
"latino democrats arrested protesting trump on immigration",-1,-1,MATCH
"it's time for congress to join the fight against food waste",-1,-1,MATCH
"gas-station employee gives 109 9/10ths percent",1,1,MATCH
"'support small business' demands sign in window of boutique open five hours a day, three days a week",1,-1,FAIL
"fbi: 'you know you're desperate when you're asking the american people for help'",1,-1,FAIL
"older but still young at heart",-1,-1,MATCH
"jason derulo accuses american airlines of 'racial discrimination' after luggage dispute",-1,1,FAIL
"letter to my girls about the mean girl",-1,-1,MATCH
"climate change denier battens down worldview to weather hurricane irma",1,1,MATCH
"journey of self-discovery leads man to realization he doesn't care",1,1,MATCH
"man burning in hell wishes he hadn't snickered at religious leaflet",1,1,MATCH
"pope francis admits god really starting to look old",1,1,MATCH
"teens freak out while watching old cigarette commercials",-1,1,FAIL
"marco rubio avoids criticizing jeb bush after debate tussle over missed senate votes",-1,-1,MATCH
"colgate unveils new dental grout to fill in gaps between teeth",1,1,MATCH
"local man a paper-towel black hole",1,1,MATCH
"6 facts you didn't know about trade and how they affect you",-1,-1,MATCH
"let's not lose sight of the real problems at mizzou",-1,-1,MATCH
"the most wtf moments from men's new york fashion week",-1,-1,MATCH
"caught on video: the terrifying moment a car went off a cliff",-1,-1,MATCH
"man forced to come up with 45 seconds of facial expressions while waitress lists off specials",1,1,MATCH
"why is the naacp in bed with donald sterling?",-1,-1,MATCH
"jerry brown: 'troglodyte' trump supporters 'dwell in deep, dark caves'",-1,-1,MATCH
"report: this movie old enough that they might have actually hurt dog",1,1,MATCH
"sec commissioner: we shouldn't be promoting investor confidence",-1,-1,MATCH
"sandra bland swallowed or smoked 'large quantity of marijuana' in jail: da",-1,1,FAIL
"of course dick morris might join the trump campaign",-1,-1,MATCH
"if you feel too stressed to have sex, from dr. gail saltz (video)",-1,1,FAIL
"learning from a complex communications experiment in my own home",-1,-1,MATCH
"new evidence reveals ancient greeks immediately regretted inventing theater",1,1,MATCH
"paul ryan says he doesn't want to work with democrats on health care",-1,-1,MATCH
"a taste of proper fun: bermuda",-1,-1,MATCH
"5 scientific reasons you should go on vacation",-1,-1,MATCH
"long-lost salamander rediscovered in guatemalan jungle",-1,1,FAIL
"everything better now in oklahoma city",1,1,MATCH
"everything you need to know before watching the 'stranger things' season 2 premiere",-1,-1,MATCH
"donald trump gave the pope a sculpture his holiness will probably regift",-1,-1,MATCH
"rotating knife vortex closed pending safety investigation",1,1,MATCH
"report: new york state senate leader to be arrested for corruption",-1,1,FAIL
"a new kind of valentine's day",-1,-1,MATCH
"will content marketing replace traditional sales?",-1,-1,MATCH
"here's why congressman blake farenthold resigned so abruptly",-1,-1,MATCH
"obama still hasn't figured out how to adjust height of oval office desk chair",1,1,MATCH
"graffiti artist no longer putting his heart in it",1,1,MATCH
"'ant-man and the wasp' trailer brings the fun after 'avengers: infinity war'",-1,-1,MATCH
"aides concerned trump's mental health declining after president admits he may not be omnipotent living god",1,-1,FAIL
"has alzheimer's been cured?",-1,1,FAIL
"mega monster cookie bars you'll want to stuff in yo' face",-1,-1,MATCH
"fake trump says meryl streep is 'no tara reid' in conan's spoof phone calls",-1,-1,MATCH
"aftershock a real 'fuck you' to earthquake victims",1,-1,FAIL
"trump takes moment to thank all the fear in audience for making this night possible",1,-1,FAIL
"iran warns of retaliation if u.s. breaches nuclear deal",-1,1,FAIL
"$9 billion is a lot of money: how much could you buy with illinois' budget deficit?",-1,-1,MATCH
"key gop senator will oppose donald trump's arms deal with saudi arabia",-1,-1,MATCH
"d-wade, udonis haslem, and lebron opt out",-1,-1,MATCH
"lieberman's overlords most displeased",1,1,MATCH
"milkshake almost ruined by breakup",1,1,MATCH
"my first man-crush: james garner",-1,-1,MATCH
"top aide denies that donald trump posed as his own spokesman",-1,-1,MATCH
"jonathan franzen rushes over to guy on subway reading 'the corrections' to introduce himself",1,1,MATCH
"al-qaeda chatter deteriorates into gossip",1,1,MATCH
"south korean president eats full, balanced meal in show of strength against north",1,-1,FAIL
"waiter seriously needs his apps",1,-1,FAIL
"beyonce shows love for 'cha cha' and lone star beer",-1,-1,MATCH
"latest news of israeli-palestinian violence makes man hungry for falafel",1,1,MATCH
"what aarp wants to hear most from the presidential candidates",-1,-1,MATCH
"i'm no longer addicted to giving up facebook!",-1,1,FAIL
"panicked man looking for son stressing everybody out",1,1,MATCH
"parents floored by stranger's kind act following their toddler's tantrum",-1,1,FAIL
"martin o'malley explains how he'd expand social security as progressives wait on hillary clinton",-1,-1,MATCH
"these illustrations perfectly sum up what it's like to have anxiety",-1,-1,MATCH
"grieving daughter says mom drinks too much and started bringing home 'random men' since dad died",-1,-1,MATCH
"gop plan to avoid september shutdown: we'll get back to you later",-1,-1,MATCH
"viewers impressed by how male trump looked during debate",1,-1,FAIL
"obama predicts bright future for legal weed",-1,1,FAIL
"nation's sports fans shocked by truth about 'we will rock you' anthem",1,1,MATCH
"sudden computer restart vomits up bilious mess of unsaved documents on screen",1,1,MATCH
"brad pitt sidelined 6 to 8 weeks with red carpet toe",1,-1,FAIL
"report: america ready for third ketchup brand",1,1,MATCH
"ergonomic advisors call for $30 million in federal lumbar support",1,-1,FAIL
"astronomers predict giant asteroid will hit nation's theaters this summer",1,1,MATCH
"the warwick rowers' calendar apparently deemed 'gay propaganda' in russia",-1,-1,MATCH
"those we lost in 2011",1,-1,FAIL
"'holy s**t!': airplane lands right in front of driver on ny highway",-1,1,FAIL
"2-year-old neil degrasse tyson pens awesome birthday thank you",-1,-1,MATCH
"texas high school coach allegedly told black students 'i'm going to hang you in that tree'",-1,-1,MATCH
"dirty, disheveled scott pruitt confesses he spent last of epa funding weeks ago",1,1,MATCH
"study: 74% of home contractors end up accidentally walling themselves in during housing construction",1,1,MATCH
"this time to be different",1,1,MATCH
"area man accidentally responds to own 'm4m' ad",1,1,MATCH
"report: typical city bus contains no fewer than four erections at any given time",1,1,MATCH
"stupid magazine ranks some stupid crap",1,1,MATCH
